total_raised,total_contributions,date,committee,committee_name
28865421.919999868,656673,2020-10,C00027466,NRSC
26151726.73000723,579595,2020-11,C00027466,NRSC
1609753.0400000408,38920,2020-11,C00651208,"JOHN JAMES FOR SENATE, INC."
2087175.2700000363,86703,2020-11,C00458828,"TEAM GRAHAM, INC."
6378523.329994687,198138,2020-11,C00193342,MCCONNELL SENATE COMMITTEE
34474705.38988941,658831,2020-11,C00729608,GEORGIANS FOR KELLY LOEFFLER
35902037.05003551,649587,2020-11,C00547570,PERDUE FOR SENATE
2844859.099999976,70640,2020-10,C00547570,PERDUE FOR SENATE
9382642.21000002,252085,2020-10,C00193342,MCCONNELL SENATE COMMITTEE
129050.73999999958,3408,2020-11,C00143743,REPUBLICAN PARTY OF TEXAS
133216599.05008718,2047686,2020-10,C00580100,"DONALD J. TRUMP FOR PRESIDENT, INC."
1507308.4100000001,41521,2020-10,C00420935,KEVIN MCCARTHY FOR CONGRESS
15565589.819999315,337924,2020-10,C00666040,MCSALLY FOR SENATE INC
8585481.550000172,189458,2020-10,C00651208,"JOHN JAMES FOR SENATE, INC."
32263379.119974792,704794,2020-10,C00458828,"TEAM GRAHAM, INC."
6508938.020000161,151818,2020-10,C00546788,JONI FOR IOWA
450911.87000002374,11298,2020-10,C00717322,RODIMER FOR CONGRESS
3717706.0799999284,70540,2020-10,C00545772,THOM TILLIS COMMITTEE
135110.13,817,2020-10,C00720870,JESSE JENSEN FOR CONGRESS
38336.020000000695,895,2020-10,C00497818,WENSTRUP FOR CONGRESS
6461312.81999992,177217,2020-10,C00491357,STEVE DAINES FOR MONTANA
543926.6600000007,12636,2020-10,C00729608,GEORGIANS FOR KELLY LOEFFLER
37860.130000000005,1029,2020-10,C00304758,FRIENDS OF ROY BLUNT
268665.6900000076,5938,2020-10,C00715854,ALEK FOR OREGON
1453869.2899999851,44550,2020-10,C00547893,ELISE FOR CONGRESS
507341.4300000004,17690,2020-10,C00499988,"COTTON FOR SENATE, INC."
2273534.800000034,49638,2020-10,C00369033,TEXANS FOR SENATOR JOHN CORNYN INC.
1938395.5899999975,62090,2020-10,C00711689,LACY JOHNSON FOR CONGRESS
1877485.1199999964,51940,2020-10,C00726117,KIM KLACIK FOR CONGRESS
2574617.72,87611,2020-10,C00540302,TIM SCOTT FOR SENATE
691115.2999999858,20589,2020-10,C00725853,BURGESS 4 UTAH
4071226.4900000207,94560,2020-10,C00314575,COLLINS FOR SENATOR
2579733.2100000414,64022,2020-10,C00492454,CORY GARDNER FOR SENATE
28998.2,291,2020-10,C00717868,HOUSE CD6
20435.53,669,2020-10,C00384529,LISA MURKOWSKI FOR US SENATE
77119.26999999989,2851,2020-10,C00230482,"GRASSLEY COMMITTEE, INC."
640894.2900000003,12593,2020-10,C00701672,"TUBERVILLE FOR SENATE, INC."
644813.8900000006,9922,2020-10,C00570994,ALASKANS FOR DAN SULLIVAN
358199.6600000095,9301,2020-10,C00704981,MICHELLE STEEL FOR CONGRESS
1517161.2599999974,33865,2020-10,C00370056,DEVIN NUNES CAMPAIGN COMMITTEE
190600.5900000014,1797,2020-10,C00725259,ESSHAKI FOR CONGRESS
85383.04,2008,2020-10,C00395467,JEFF FORTENBERRY FOR UNITED STATES CONGRESS
70020.35999999997,2235,2020-10,C00459255,"FRIENDS OF TODD YOUNG, INC."
325117.4500000161,16301,2020-10,C00632257,MAST FOR CONGRESS
170407.44000000242,4684,2020-10,C00732925,KISTNER FOR CONGRESS
435218.5000000009,6609,2020-10,C00576173,KANSANS FOR MARSHALL
188192.61000000004,941,2020-10,C00717876,AMANDA ADKINS FOR CONGRESS
67574.88000000201,3345,2020-10,C00718346,KANSANS FOR LATURNER
63796.20000000121,1692,2020-10,C00715466,DAVID RICHTER FOR CONGRESS INC.
90994.98999999999,289,2020-10,C00677286,"STEIL FOR WISCONSIN, INC."
960122.0599999758,31187,2020-10,C00732958,CAWTHORN FOR NC
601520.0999999811,15843,2020-10,C00710103,NANCY MACE FOR CONGRESS
124325.5700000012,5120,2020-10,C00742247,SCOTT FRANKLIN FOR CONGRESS
118334.15,699,2020-10,C00739177,KEVIN O'CONNOR FOR U.S. SENATE INC.
232780.68000000226,8658,2020-10,C00712794,JEANNE FOR CONGRESS
1720101.9399999985,35763,2020-10,C00716860,JASON LEWIS FOR SENATE
89207.32999999882,2533,2020-10,C00666396,MICHAEL WALTZ FOR CONGRESS
244955.42999999985,9505,2020-10,C00652727,JOSH HAWLEY FOR SENATE
59511.0,86,2020-10,C00632067,RON ESTES FOR CONGRESS
145803.07000000254,3651,2020-10,C00735688,BOGNET FOR CONGRESS
249623.1600000044,4493,2020-10,C00715235,COLLINS FOR TEXAS
37422.390000000465,1039,2020-10,C00657833,GUY FOR CONGRESS
20548.0,138,2020-10,C00706275,PALLOTTA FOR CONGRESS
29139.939999999806,2394,2020-10,C00720011,SCOTT FITZGERALD FOR CONGRESS
633536.3700000049,12907,2020-10,C00660795,DAN CRENSHAW FOR CONGRESS
52559.329999999994,641,2020-10,C00373001,CITIZENS FOR TURNER
252982.36000001346,5106,2020-10,C00716498,ESTHER FOR CONGRESS
254835.02999999755,8546,2020-10,C00548289,MATT ROSENDALE FOR MONTANA
54934.37999999856,2116,2020-10,C00545749,EMMER FOR CONGRESS
72984.24000000142,2242,2020-10,C00722892,"SCHELLER FOR CONGRESS, INC."
161233.35999999996,3636,2020-10,C00633362,"HANDEL FOR CONGRESS, INC."
309360.1500000001,9715,2020-10,C00734491,MOWERS FOR CONGRESS
19242.42000000001,166,2020-10,C00629949,ALEX MOONEY FOR CONGRESS
58409791.65002455,1054834,2020-11,C00580100,"DONALD J. TRUMP FOR PRESIDENT, INC."
178698.27999999994,5552,2020-11,C00732958,CAWTHORN FOR NC
2110188.669999994,56061,2020-11,C00666040,MCSALLY FOR SENATE INC
364918.5100000003,10275,2020-11,C00726117,KIM KLACIK FOR CONGRESS
13310.769999999993,378,2020-11,C00720078,JAY OBERNOLTE FOR CONGRESS 2020
13551.11999999999,31,2020-11,C00738872,BLAKE MOORE FOR CONGRESS
1059615.219999986,38495,2020-11,C00491357,STEVE DAINES FOR MONTANA
28507.89,823,2020-11,C00576173,KANSANS FOR MARSHALL
82059.74999999991,2388,2020-11,C00552547,ZELDIN FOR CONGRESS
133596.8600000003,4557,2020-11,C00632828,CLAUDIA TENNEY FOR CONGRESS
177612.40000000846,5263,2020-11,C00725853,BURGESS 4 UTAH
263048.57999999996,7547,2020-11,C00762237,DEVOLDER SANTOS FOR CONGRESS RECOUNT
135292.37999999998,3524,2020-11,C00721365,DEVOLDER-SANTOS FOR CONGRESS
22853.230000000425,971,2020-11,C00504522,HUDSON FOR CONGRESS
410638.60999999876,15309,2020-11,C00701102,MIKE GARCIA FOR CONGRESS
239100.28000000006,8015,2020-11,C00711689,LACY JOHNSON FOR CONGRESS
25732.940000000595,891,2020-10,C00653220,CAROL FOR CONGRESS
7420.0,29,2020-10,C00674259,DR JOHN JOYCE FOR CONGRESS
28185.0,24,2020-10,C00331397,SIMPSON FOR CONGRESS
19502.639999999996,203,2020-10,C00461806,PAUL GOSAR FOR CONGRESS
134781.33000000205,11107,2020-10,C00607416,BRIAN FITZPATRICK FOR CONGRESS
132908.07,3484,2020-10,C00539825,CAPITO FOR WEST VIRGINIA
16531.100000000002,429,2020-10,C00607838,DREW FERGUSON FOR CONGRESS INC.
21910.2,77,2020-10,C00543967,BUDDY CARTER FOR CONGRESS
318577.85,5324,2020-10,C00543983,BILL CASSIDY FOR US SENATE
94991.7399999992,3085,2020-10,C00467571,"ANDY BARR FOR CONGRESS, INC."
109752.14000000141,3798,2020-10,C00545616,"YOUNG FOR IOWA, INC."
55294.58000000063,2423,2020-10,C00741090,DIANA FOR CONGRESS
133225.78999999998,2914,2020-10,C00718627,TEAM HAGERTY
685963.6400000025,19659,2020-10,C00608398,JOHN KENNEDY FOR US
325705.7499999986,10248,2020-10,C00495846,ANN WAGNER FOR CONGRESS
97889.65000000063,2812,2020-10,C00368522,JOE WILSON FOR CONGRESS
313784.3000000084,6023,2020-10,C00143743,REPUBLICAN PARTY OF TEXAS
134792.95000000185,4576,2020-10,C00717959,FISCHBACH FOR CONGRESS
328917.2500000009,9265,2020-11,C00369033,TEXANS FOR SENATOR JOHN CORNYN INC.
1210086.8199999994,35218,2020-11,C00420935,KEVIN MCCARTHY FOR CONGRESS
338809.5900000115,11572,2020-11,C00545772,THOM TILLIS COMMITTEE
8452.0,24,2020-11,C00372532,MICHAEL BURGESS FOR CONGRESS
16560.0,184,2020-11,C00733469,MARK RONCHETTI FOR NEW MEXICO
37599.780000000006,453,2020-11,C00304758,FRIENDS OF ROY BLUNT
67834.68000000021,1232,2020-10,C00710962,PETER MEIJER FOR CONGRESS
104648.70000000001,1517,2020-10,C00713412,MESSNER FOR SENATE
22742.11,606,2020-11,C00539825,CAPITO FOR WEST VIRGINIA
517482.7699999999,13151,2020-10,C00394957,SCALISE FOR CONGRESS
22292.5,137,2020-10,C00459297,HUIZENGA FOR CONGRESS
741837.769999999,23314,2020-10,C00416594,JIM JORDAN FOR CONGRESS
467567.1699999837,10732,2020-10,C00671859,MARIA ELVIRA SALAZAR FOR CONGRESS
99967.10000000194,2508,2020-10,C00392688,"MCCAUL FOR CONGRESS, INC"
34322.28000000013,1349,2020-10,C00458877,KINZINGER FOR CONGRESS
788044.9099999864,18646,2020-10,C00701003,HUNT FOR CONGRESS
219703.08000000552,2661,2020-10,C00703058,KEAN FOR CONGRESS INC
348136.60999999713,10576,2020-10,C00703843,BICE FOR CONGRESS
141922.77999999913,2611,2020-10,C00721142,ANDREWS FOR CONGRESS
271746.42000001477,9278,2020-10,C00706267,ASHLEY HINSON FOR CONGRESS
60079.5,199,2020-10,C00721365,DEVOLDER-SANTOS FOR CONGRESS
79450.17000000038,4263,2020-10,C00638411,HAGAN FOR CONGRESS
319853.6300000111,9638,2020-10,C00729335,FRIENDS OF NICK FREITAS INC
182050.9400000012,9096,2020-10,C00655571,YVETTE4CONGRESS
85913.18999999925,1101,2020-10,C00441014,ROB WITTMAN FOR CONGRESS
172406.8900000012,1915,2020-10,C00657155,TIFFANY SHEDD FOR CONGRESS COMMITTEE
94430.88,376,2020-10,C00498121,ROGER WILLIAMS FOR U S CONGRESS COMMITTEE
16215.210000000003,34,2020-10,C00458679,BLAINE FOR CONGRESS
320437.4700000002,12194,2020-10,C00620518,MARCO RUBIO FOR SENATE
175861.09999999983,3899,2020-10,C00742007,VAN ORDEN FOR CONGRESS
173944.16000000245,13643,2020-10,C00472704,JAIME FOR CONGRESS
18564.0,105,2020-10,C00737650,VAN DE WATER FOR CONGRESS
117445.55999999573,6555,2020-10,C00510164,PATRIOTS FOR PERRY
266217.7700000056,12639,2020-10,C00561183,TENNEY FOR CONGRESS
375629.60000000003,5420,2020-10,C00733469,MARK RONCHETTI FOR NEW MEXICO
24575.0,125,2020-10,C00464032,TOM REED FOR CONGRESS
78693.75000000121,1766,2020-10,C00726687,PAUL JUNGE FOR CONGRESS
111081.25000000035,2596,2020-10,C00713461,KENDALL FOR CONGRESS
64822.71000000075,3037,2020-10,C00012229,ALASKANS FOR DON YOUNG
85807.47999999551,6122,2020-10,C00662767,CHIP ROY FOR CONGRESS
121528.7099999979,2906,2020-10,C00390476,CATHY MCMORRIS RODGERS FOR CONGRESS
43614.299999999756,3231,2020-10,C00371203,JOHN CARTER FOR CONGRESS
44441.31,611,2020-10,C00701433,CHELE FARLEY FOR CONGRESS INC.
185416.82000000353,8083,2020-10,C00729954,GARBARINO FOR CONGRESS
31627.66000000001,201,2020-10,C00734251,"STREICKER FOR CONGRESS, INC."
152221.5799999989,10022,2020-10,C00504522,HUDSON FOR CONGRESS
68563.00000000065,2582,2020-10,C00693663,FEENSTRA FOR CONGRESS
54591.819999999665,2226,2020-10,C00738872,BLAKE MOORE FOR CONGRESS
91938.82999999888,11619,2020-10,C00550707,FRIENDS OF HAGEDORN
35056.50000000002,191,2020-10,C00412759,VERN BUCHANAN FOR CONGRESS
199917.38000000673,12692,2020-10,C00552547,ZELDIN FOR CONGRESS
206865.03000000684,6318,2020-10,C00714865,BETH VAN DUYNE FOR CONGRESS
13193.050000000007,196,2020-10,C00633610,RALPH NORMAN FOR CONGRESS
556460.2199999962,13216,2020-10,C00718239,ANNA PAULINA LUNA FOR CONGRESS
39547.71999999947,1012,2020-10,C00610212,MIKE GALLAGHER FOR WISCONSIN
235058.10000000586,4226,2020-10,C00694778,NICOLE FOR NEW YORK
152855.0700000006,3744,2020-10,C00521948,RODNEY FOR CONGRESS
65406.52999999988,469,2020-10,C00718635,"TIFFANY FOR WISCONSIN, INC."
155239.8200000037,4365,2020-10,C00733394,TAYLOR FOR CONGRESS 2020
121509.45999999855,5339,2020-10,C00730150,NEHLS FOR CONGRESS
72464.21000000017,3022,2020-10,C00730895,KAT FOR CONGRESS
489392.1799999879,12757,2020-10,C00724914,AMERICANS FOR PARNELL COMMITTEE
145766.6799999962,5800,2020-10,C00735985,CARLOS GIMENEZ FOR CONGRESS
76791.54000000001,2581,2020-10,C00301838,STEVE CHABOT FOR CONGRESS
354131.28000000987,14855,2020-10,C00665638,YOUNG KIM FOR CONGRESS
16855.0,53,2020-10,C00636092,HERN FOR CONGRESS
14975.0,16,2020-10,C00473132,MCKINLEY FOR CONGRESS
78176.19,1719,2020-10,C00458463,PORTMAN FOR SENATE COMMITTEE
13064.99,93,2020-10,C00732727,DASHA FOR CONGRESS
37835.20000000002,477,2020-10,C00501643,DAVID ROUZER FOR CONGRESS
18067.550000000017,88,2020-10,C00393629,MCHENRY FOR CONGRESS
87291.06,2343,2020-10,C00547976,"BEN SASSE FOR U.S. SENATE, INC."
153821.73000000315,2813,2020-10,C00575167,DON BACON FOR CONGRESS
106571.43999999993,3265,2020-10,C00722454,DALE CRAFTS FOR CONGRESS
157593.64999999863,4447,2020-10,C00499392,VALADAO FOR CONGRESS
102697.96999999997,3671,2020-10,C00612432,FRIENDS OF MATT GAETZ
32562.19000000049,1191,2020-10,C00663914,DEBBIE LESKO FOR CONGRESS
18027.32,66,2020-10,C00608695,MIKE JOHNSON FOR LOUISIANA
150651.7500000019,4433,2020-10,C00706614,TONY GONZALES FOR CONGRESS
31785.430000000415,2074,2020-10,C00460659,MANN FOR CONGRESS
23479.04,203,2020-10,C00708073,RONDA KENNEDY FOR CONGRESS 2020
37285.44999999995,664,2020-10,C00614776,TED BUDD FOR CONGRESS
86060.59000000432,7831,2020-10,C00706747,FRIENDS OF MCCORMICK
32488.380000000012,968,2020-10,C00409581,FRIENDS OF JOHN THUNE
4426.370000000003,140,2020-10,C00697052,FRED KELLER FOR CONGRESS
4135.0,25,2020-10,C00450353,FRIENDS OF PETER THERON
18400.0,9,2020-10,C00551374,GARY PALMER FOR CONGRESS
31955.2,170,2020-10,C00372532,MICHAEL BURGESS FOR CONGRESS
106521.47,511,2020-10,C00711572,BECCHI FOR CONGRESS
6664.0,84,2020-10,C00708289,GREENE FOR CONGRESS
3155.0,8,2020-10,C00558486,GARRET GRAVES FOR CONGRESS
12796.0,28,2020-10,C00582304,FRIENDS OF NEAL DUNN
33138.0,49,2020-10,C00742106,LETLOW FOR CONGRESS
212748.65999999933,14554,2020-10,C00661868,VAN DREW FOR CONGRESS
2800.0,1,2020-10,C00698373,MARTIN FOR FREEDOM
76262.39000000029,3564,2020-10,C00200584,UPTON FOR ALL OF US
235060.9100000032,6529,2020-10,C00733329,BYRON DONALDS FOR CONGRESS
6748.0,117,2020-10,C00741538,"STANTON-KING FOR CONGRESS, INC."
135068.21,2724,2020-10,C00734731,FRIENDS FOR KATHY BARNETTE
156474.96,4336,2020-10,C00675348,CINDY HYDE-SMITH FOR US SENATE
118046.61,3402,2020-10,C00730531,TEXANS FOR RONNY JACKSON
20680.0,35,2020-10,C00654723,MEUSER FOR CONGRESS
57622.729999999814,2784,2020-10,C00737767,VICTORIA SPARTZ FOR CONGRESS
21672.699999999997,246,2020-10,C00582635,JO RAE PERKINS FOR US SENATE
31450.159999999996,1085,2020-10,C00607556,LIZ CHENEY FOR WYOMING
84368.84999999998,841,2020-10,C00699660,BISHOP FOR CONGRESS
94311.12999999843,2955,2020-11,C00705236,JOE COLLINS FOR CONGRESS
4089.0,18,2020-11,C00711572,BECCHI FOR CONGRESS
49856.73,1781,2020-11,C00671859,MARIA ELVIRA SALAZAR FOR CONGRESS
228261.7100000001,7454,2020-11,C00416594,JIM JORDAN FOR CONGRESS
7372.080000000005,323,2020-11,C00657833,GUY FOR CONGRESS
6425.0,7,2020-11,C00504019,RICK W. ALLEN FOR CONGRESS
4542.49,40,2020-11,C00412759,VERN BUCHANAN FOR CONGRESS
9612.5,20,2020-11,C00677286,"STEIL FOR WISCONSIN, INC."
84121.59999999948,2592,2020-11,C00660795,DAN CRENSHAW FOR CONGRESS
3800.0,4,2020-11,C00412890,ADRIAN SMITH FOR CONGRESS
30236.9799999999,1185,2020-11,C00390476,CATHY MCMORRIS RODGERS FOR CONGRESS
13028.039999999985,637,2020-11,C00607556,LIZ CHENEY FOR WYOMING
410416.62999999995,10943,2020-11,C00394957,SCALISE FOR CONGRESS
10446.879999999997,475,2020-11,C00368522,JOE WILSON FOR CONGRESS
17772.099999999984,1699,2020-11,C00200584,UPTON FOR ALL OF US
16337.659999999823,1113,2020-11,C00392688,"MCCAUL FOR CONGRESS, INC"
69238.61999999853,3423,2020-11,C00632257,MAST FOR CONGRESS
9481.220000000014,340,2020-11,C00610212,MIKE GALLAGHER FOR WISCONSIN
571201.6200000003,15594,2020-11,C00370056,DEVIN NUNES CAMPAIGN COMMITTEE
4964.259999999954,583,2020-11,C00663914,DEBBIE LESKO FOR CONGRESS
3747.9900000000007,46,2020-11,C00461806,PAUL GOSAR FOR CONGRESS
395271.15000001126,13950,2020-11,C00547893,ELISE FOR CONGRESS
4605.8499999999985,18,2020-11,C00629949,ALEX MOONEY FOR CONGRESS
751300.1500000022,23565,2020-11,C00546788,JONI FOR IOWA
62930.289999999884,1600,2020-11,C00701672,"TUBERVILLE FOR SENATE, INC."
17881.579999999973,516,2020-11,C00729335,FRIENDS OF NICK FREITAS INC
46366.779999999824,4281,2020-11,C00703843,BICE FOR CONGRESS
26014.72999999977,938,2020-11,C00717322,RODIMER FOR CONGRESS
31712.799999999974,611,2020-11,C00734491,MOWERS FOR CONGRESS
162600.76000000007,4581,2020-11,C00716860,JASON LEWIS FOR SENATE
23914.440000000002,1330,2020-11,C00495846,ANN WAGNER FOR CONGRESS
14392.869999999948,1389,2020-11,C00655571,YVETTE4CONGRESS
161577.81999999878,5810,2020-11,C00492454,CORY GARDNER FOR SENATE
476251.7800000005,16092,2020-11,C00314575,COLLINS FOR SENATOR
290224.7099999973,9223,2020-11,C00724914,AMERICANS FOR PARNELL COMMITTEE
7079.0,33,2020-11,C00739177,KEVIN O'CONNOR FOR U.S. SENATE INC.
51143.80999999967,3286,2020-11,C00661868,VAN DREW FOR CONGRESS
21475.35999999968,1798,2020-11,C00521948,RODNEY FOR CONGRESS
35019.24000000009,973,2020-11,C00732925,KISTNER FOR CONGRESS
2930.0,4,2020-11,C00582304,FRIENDS OF NEAL DUNN
8885.0,10,2020-11,C00632067,RON ESTES FOR CONGRESS
15712.370000000134,2121,2020-11,C00441014,ROB WITTMAN FOR CONGRESS
18683.609999999942,1382,2020-11,C00729954,GARBARINO FOR CONGRESS
20125.67000000011,1103,2020-11,C00735985,CARLOS GIMENEZ FOR CONGRESS
10928.009999999977,187,2020-11,C00733329,BYRON DONALDS FOR CONGRESS
39919.69000000013,1479,2020-11,C00570994,ALASKANS FOR DAN SULLIVAN
7463.86,95,2020-11,C00373001,CITIZENS FOR TURNER
25341.15,898,2020-11,C00376939,MARSHA FOR SENATE
5474.5999999999985,444,2020-11,C00722454,DALE CRAFTS FOR CONGRESS
11393.909999999962,409,2020-11,C00733394,TAYLOR FOR CONGRESS 2020
22825.229999999818,1343,2020-11,C00694778,NICOLE FOR NEW YORK
7949.0,252,2020-11,C00666859,MARYOTT FOR CONGRESS
109558.91000000048,4306,2020-11,C00499988,"COTTON FOR SENATE, INC."
5804.92,103,2020-11,C00548180,WESTERMAN FOR CONGRESS
12017.5,61,2020-11,C00464032,TOM REED FOR CONGRESS
13010.7299999999,1426,2020-11,C00717959,FISCHBACH FOR CONGRESS
63817.92999999993,1792,2020-11,C00714865,BETH VAN DUYNE FOR CONGRESS
123819.10000000005,138,2020-11,C00742106,LETLOW FOR CONGRESS
344754.469999999,14381,2020-11,C00665638,YOUNG KIM FOR CONGRESS
73975.77999999808,6106,2020-11,C00735688,BOGNET FOR CONGRESS
122307.7800000026,8050,2020-11,C00696872,JIM 2020 COMMITTEE
133350.03000000157,8767,2020-11,C00558825,MILLER-MEEKS FOR CONGRESS
48421.45999999964,2359,2020-11,C00652727,JOSH HAWLEY FOR SENATE
68502.2599999998,6890,2020-11,C00499392,VALADAO FOR CONGRESS
3554.8500000000026,100,2020-11,C00540617,FRIENDS OF DAVID SCHWEIKERT
4802.160000000006,120,2020-11,C00501643,DAVID ROUZER FOR CONGRESS
43509.62000000035,1924,2020-11,C00561183,TENNEY FOR CONGRESS
768241.4999999872,29527,2020-11,C00540302,TIM SCOTT FOR SENATE
679712.1299999978,14622,2020-11,C00608398,JOHN KENNEDY FOR US
26350.0,21,2020-10,C00412890,ADRIAN SMITH FOR CONGRESS
8617.58,273,2020-10,C00458315,MORAN FOR KANSAS
13699.110000000039,961,2020-10,C00617662,CAPTAIN HIGGINS FOR CONGRESS
37199.42,359,2020-10,C00650697,PETE STAUBER FOR CONGRESS
27167.300000000007,1195,2020-11,C00492785,TED CRUZ FOR SENATE
19019.210000000003,79,2020-10,C00541862,JASON SMITH FOR CONGRESS
44780.6,1412,2020-10,C00436386,FRIENDS OF JOHN BARRASSO
122404.00999999966,6034,2020-11,C00704981,MICHELLE STEEL FOR CONGRESS
15293.639999999976,619,2020-11,C00715235,COLLINS FOR TEXAS
2780.3999999999996,9,2020-11,C00408534,BILIRAKIS FOR CONGRESS
12836.700000000004,78,2020-11,C00559393,DAN NEWHOUSE FOR CONGRESS
12738.010000000004,311,2020-11,C00699660,BISHOP FOR CONGRESS
40236.93000000007,1226,2020-11,C00701003,HUNT FOR CONGRESS
15220.600000000002,31,2020-10,C00444620,FRIENDS OF GLENN THOMPSON
1348284.8499999987,35169,2020-10,C00705236,JOE COLLINS FOR CONGRESS
12713.359999999995,279,2020-10,C00330886,MIKE CRAPO FOR US SENATE
9630.0,67,2020-10,C00504019,RICK W. ALLEN FOR CONGRESS
112394.53,5633,2020-10,C00390724,WALBERG FOR CONGRESS
4182.869999999999,25,2020-11,C00710962,PETER MEIJER FOR CONGRESS
6372.5,25,2020-11,C00717876,AMANDA ADKINS FOR CONGRESS
7734.499999999989,659,2020-11,C00730150,NEHLS FOR CONGRESS
7104.560000000003,315,2020-11,C00722892,"SCHELLER FOR CONGRESS, INC."
2250.0,6,2020-11,C00096412,FRIENDS OF CHRIS SMITH
94805.73000000005,2942,2020-11,C00459255,"FRIENDS OF TODD YOUNG, INC."
10491.45,189,2020-11,C00721142,ANDREWS FOR CONGRESS
210212.27999999997,8651,2020-11,C00620518,MARCO RUBIO FOR SENATE
8501.390000000018,416,2020-11,C00666396,MICHAEL WALTZ FOR CONGRESS
23726.40000000001,100,2020-10,C00408534,BILIRAKIS FOR CONGRESS
27112.640000000032,390,2020-10,C00559393,DAN NEWHOUSE FOR CONGRESS
14320.0,196,2020-10,C00701755,JOY FOR NY
5522.079999999961,885,2020-10,C00464602,VICKY HARTZLER FOR CONGRESS
9373.46,189,2020-10,C00739581,THE BILLY PREMPEH FOR CONGRESS COMMITTEE
11134.919999999998,179,2020-10,C00561530,MOOLENAAR FOR CONGRESS
33726.68000000005,1309,2020-10,C00498907,DEB FISCHER FOR US SENATE
2830.0,9,2020-10,C00477323,PALAZZO FOR CONGRESS
289170.3599999988,14697,2020-10,C00701102,MIKE GARCIA FOR CONGRESS
46009.280000000086,3233,2020-10,C00719294,AUGUST PFLUGER FOR CONGRESS
1500.0,1,2020-11,C00464073,FRIENDS OF SCOTT DESJARLAIS
27186.929999999997,527,2020-11,C00458463,PORTMAN FOR SENATE COMMITTEE
2171.0,14,2020-11,C00740449,MANGA FOR CONGRESS
9357.75,357,2020-10,C00466482,FAMILIES FOR JAMES LANKFORD
12330.379999999992,833,2020-11,C00716498,ESTHER FOR CONGRESS
25964.06,798,2020-10,C00443218,WICKER FOR SENATE
6482.76,231,2020-11,C00330886,MIKE CRAPO FOR US SENATE
20351.469999999994,975,2020-11,C00473827,FRIENDS OF MIKE LEE INC
16293.03,642,2020-11,C00676965,RICK SCOTT FOR FLORIDA
4688.25,116,2020-11,C00670695,ROMNEY FOR UTAH INC
22399.450000000023,814,2020-11,C00230482,"GRASSLEY COMMITTEE, INC."
13864.500000000004,284,2020-11,C00443218,WICKER FOR SENATE
15711.549999999997,407,2020-11,C00409581,FRIENDS OF JOHN THUNE
114620.79000000001,5221,2020-10,C00492785,TED CRUZ FOR SENATE
35211.73999999992,2244,2020-11,C00706267,ASHLEY HINSON FOR CONGRESS
44306.620000000046,2672,2020-10,C00720078,JAY OBERNOLTE FOR CONGRESS 2020
22366.829999999867,2260,2020-10,C00697789,JERRY CARL FOR CONGRESS
15796.2,186,2020-10,C00740449,MANGA FOR CONGRESS
358079.6000000001,6477,2020-10,C00716571,"GADE FOR VIRGINIA, INC."
29476.030000000486,2272,2020-10,C00614214,BERGMANFORCONGRESS
122869.30999999997,4029,2020-10,C00711432,ERIC EARLY FOR CONGRESS 2020
49043.44,1584,2020-10,C00666859,MARYOTT FOR CONGRESS
51885.119999999995,4985,2020-10,C00558825,MILLER-MEEKS FOR CONGRESS
3690.2,65,2020-10,C00716340,CURRAN FOR SENATE
17690.509999999773,2015,2020-10,C00556365,KATKO FOR CONGRESS
29171.050000000316,2416,2020-10,C00723916,MARY MILLER FOR CONGRESS
9794.5,92,2020-10,C00498345,MULLIN FOR CONGRESS
127706.97999999335,10323,2020-10,C00728238,LAUREN BOEBERT FOR CONGRESS
3722.0,53,2020-10,C00738302,LANCIA FOR CONGRESS
93482.04,4114,2020-10,C00588392,TODOS CON JENNIFFER INC.  DBA JENNIFFER FOR CONGRESS
16366.0,183,2020-10,C00713537,FRIENDS OF JOHN EMMONS
6384.0,72,2020-10,C00735373,WINNFORCOLORADO
21861.600000000002,421,2020-10,C00712257,CUMMINGS FOR CONGRESS
24332.46,124,2020-10,C00662650,BALDERSON FOR CONGRESS
5274.94999999994,781,2020-10,C00726000,LEO VALENTIN FOR CONGRESS
8973.47,45,2020-10,C00527457,FRIENDS OF DAVE JOYCE
17003.06,142,2020-10,C00577999,"JIM BANKS FOR CONGRESS, INC."
1930.0,27,2020-10,C00313247,ROBERT ADERHOLT FOR CONGRESS
87069.84000000007,4095,2020-10,C00376939,MARSHA FOR SENATE
97875.38999999998,4129,2020-10,C00676965,RICK SCOTT FOR FLORIDA
4743.490000000001,141,2020-10,C00706374,TAMIKA HAMILTON FOR CONGRESS
9315.610000000006,165,2020-10,C00658385,MARK GREEN FOR CONGRESS
10849.0,68,2020-10,C00743955,ELECT TUMAN
1239.0,13,2020-10,C00733568,TIM KELLY FOR CONGRESS
12905.0,20,2020-10,C00668491,WILLIAM TIMMONS FOR CONGRESS
1160.0,7,2020-10,C00588764,COMER FOR CONGRESS
30199.620000000003,228,2020-10,C00575050,LAHOOD FOR CONGRESS
20858.609999999997,568,2020-10,C00548180,WESTERMAN FOR CONGRESS
13690.800000000007,114,2020-10,C00738013,FRIENDS OF JEFF JORDAN
30318.430000001244,4115,2020-10,C00700559,GREG RATHS FOR CONGRESS 2020
46198.49000000266,5883,2020-10,C00696872,JIM 2020 COMMITTEE
36555.430000000546,4238,2020-10,C00694711,MARCHANT FOR CONGRESS
2265.929999999997,123,2020-10,C00502229,WEBER FOR CONGRESS
6250.0,4,2020-10,C00588657,TEXANS FOR JODEY ARRINGTON
4447.6699999999955,162,2020-10,C00386532,LOUIE GOHMERT FOR CONGRESS COMMITTEE
5448.439999999942,877,2020-10,C00310532,KAY GRANGER CAMPAIGN FUND
3245.0,39,2020-10,C00714378,IRENE ARMENDARIZ-JACKSON FOR CONGRESS
2290.929999999997,123,2020-10,C00662171,RON WRIGHT FOR CONGRESS
2645.71,42,2020-10,C00714618,CHAMPION FOR CONGRESS
13081.490000000013,948,2020-10,C00553859,DR. BRIAN BABIN FOR CONGRESS
1012.0,2,2020-10,C00746388,TRACE JOHANNESEN FOR CONGRESS TX-04
8173.070000000026,500,2020-10,C00653634,VAN TAYLOR CAMPAIGN
4314.370000000003,129,2020-10,C00477240,MORGAN GRIFFITH FOR CONGRESS
31056.71,1473,2020-10,C00440362,JIM RISCH FOR U.S. SENATE COMMITTEE
27312.11,549,2020-10,C00736983,"COLLINS FOR SENATE, INC."
4598.0,35,2020-10,C00651547,JOHNNY FOR CONGRESS
4915.0,49,2020-10,C00573980,KELLY FOR CONGRESS
15924.07,584,2020-10,C00504704,CRAMER FOR SENATE
7476.24,35,2020-10,C00359034,GRAVES FOR CONGRESS
2855.0,6,2020-10,C00116632,HAL ROGERS FOR CONGRESS
31522.43,852,2020-10,C00653147,MIKE BRAUN FOR INDIANA
28425.52000000012,1501,2020-10,C00443580,LUMMIS FOR WYOMING INC.
5412.010000000003,269,2020-11,C00662767,CHIP ROY FOR CONGRESS
8687.880000000001,391,2020-10,C00670695,ROMNEY FOR UTAH INC
43276.70000000033,1756,2020-11,C00710103,NANCY MACE FOR CONGRESS
4728.7700000000095,441,2020-11,C00510164,PATRIOTS FOR PERRY
8522.620000000117,1185,2020-11,C00301838,STEVE CHABOT FOR CONGRESS
16127.529999999753,3321,2020-11,C00728238,LAUREN BOEBERT FOR CONGRESS
3237.85,72,2020-11,C00713461,KENDALL FOR CONGRESS
18236.620000000003,749,2020-11,C00612432,FRIENDS OF MATT GAETZ
11827.719999999968,588,2020-11,C00548289,MATT ROSENDALE FOR MONTANA
13422.30999999984,1043,2020-11,C00737767,VICTORIA SPARTZ FOR CONGRESS
27987.629999999997,1026,2020-11,C00543983,BILL CASSIDY FOR US SENATE
14377.429999999973,570,2020-11,C00712794,JEANNE FOR CONGRESS
1000.0,1,2020-11,C00654723,MEUSER FOR CONGRESS
5887.390000000007,96,2020-11,C00742247,SCOTT FRANKLIN FOR CONGRESS
3131.0,45,2020-11,C00650697,PETE STAUBER FOR CONGRESS
4274.280000000002,272,2020-11,C00443580,LUMMIS FOR WYOMING INC.
14000.75999999985,1865,2020-11,C00607416,BRIAN FITZPATRICK FOR CONGRESS
