total_raised,total_contributions,date,committee,committee_name
20243.860000000506,1769,2020-07,C00735985,CARLOS GIMENEZ FOR CONGRESS
21460.0,108,2020-08,C00464032,TOM REED FOR CONGRESS
15590.0,28,2020-07,C00458877,KINZINGER FOR CONGRESS
27347.680000000004,363,2020-09,C00614776,TED BUDD FOR CONGRESS
17940.94,20,2020-08,C00466516,GIBBS FOR CONGRESS
96986.7600000006,3223,2020-09,C00392688,"MCCAUL FOR CONGRESS, INC"
25270.170000000002,115,2020-09,C00629949,ALEX MOONEY FOR CONGRESS
190637.73000000912,5449,2020-09,C00706267,ASHLEY HINSON FOR CONGRESS
15984.320000000002,149,2020-07,C00575050,LAHOOD FOR CONGRESS
8850.0,10,2020-07,C00738872,BLAKE MOORE FOR CONGRESS
141094.82000000967,5411,2020-07,C00706267,ASHLEY HINSON FOR CONGRESS
6755.0,8,2020-07,C00654723,MEUSER FOR CONGRESS
92335.19000000213,3439,2020-09,C00200584,UPTON FOR ALL OF US
39224.0,309,2020-07,C00441014,ROB WITTMAN FOR CONGRESS
9343.88,153,2020-07,C00719252,JESSI MELTON FOR CONGRESS
13991.260000000028,134,2020-07,C00408534,BILIRAKIS FOR CONGRESS
60239.23999999994,1474,2020-08,C00708263,AMANDA MAKKI FOR CONGRESS
7525.0,42,2020-07,C00728790,CLAIRE GUSTAFSON FOR CONGRESS 2020
226845.02000000485,9448,2020-08,C00665638,YOUNG KIM FOR CONGRESS
21260.160000000003,50,2020-07,C00734251,"STREICKER FOR CONGRESS, INC."
15588.460000000003,88,2020-08,C00459297,HUIZENGA FOR CONGRESS
54761.61000000076,1315,2020-09,C00368522,JOE WILSON FOR CONGRESS
56449.97999999995,641,2020-07,C00306704,FRIENDS OF SESSIONS SENATE COMMITTEE INC
9526.389999999998,68,2020-07,C00582635,JO RAE PERKINS FOR US SENATE
8976.0,189,2020-09,C00670695,ROMNEY FOR UTAH INC
64876.66999999999,730,2020-07,C00721142,ANDREWS FOR CONGRESS
23642.22000000015,170,2020-08,C00498121,ROGER WILLIAMS FOR U S CONGRESS COMMITTEE
23061.96,309,2020-08,C00722470,RIK FOR NEW JERSEY INC
10725.0,15,2020-08,C00729996,RANDY HENDERSON FOR CONGRESS
17475.0,32,2020-09,C00636092,HERN FOR CONGRESS
115277.2800000002,977,2020-09,C00713461,KENDALL FOR CONGRESS
74642.52,1110,2020-09,C00395467,JEFF FORTENBERRY FOR UNITED STATES CONGRESS
35903.79999999914,1397,2020-07,C00660050,COMMITTEE TO RE-ELECT STEVE WATKINS
66220.08000000162,2404,2020-07,C00633362,"HANDEL FOR CONGRESS, INC."
18008.17999999982,2528,2020-08,C00696872,JIM 2020 COMMITTEE
52434.64000000001,873,2020-09,C00666859,MARYOTT FOR CONGRESS
17090.0,39,2020-07,C00703066,HIGHTOWER FOR ALABAMA
6472.9,13,2020-08,C00743955,ELECT TUMAN
14501.2,220,2020-08,C00719864,ERROL WEBBER FOR CONGRESS
44870.749999998574,1641,2020-09,C00721332,DARRELL ISSA FOR CONGRESS
58336.27999999893,2260,2020-09,C00550707,FRIENDS OF HAGEDORN
21931.570000000032,64,2020-07,C00498121,ROGER WILLIAMS FOR U S CONGRESS COMMITTEE
27003.0,112,2020-07,C00704064,NEESE FOR CONGRESS
7913.0,43,2020-09,C00716340,CURRAN FOR SENATE
104554.22000000105,4743,2020-07,C00632257,MAST FOR CONGRESS
99394.52999999974,3358,2020-09,C00492785,TED CRUZ FOR SENATE
12009.9,68,2020-08,C00726596,YUKONG ZHAO FOR CONGRESS
28310.2,260,2020-09,C00717868,HOUSE CD6
48146.90000000031,2130,2020-08,C00510164,PATRIOTS FOR PERRY
2810.0,2,2020-09,C00692830,THE COMMITTEE TO ELECT EMILY RAFI
5380.0,37,2020-07,C00732727,DASHA FOR CONGRESS
23292.5,270,2020-09,C00722470,RIK FOR NEW JERSEY INC
35084.11,116,2020-07,C00722553,SHANE HERNANDEZ FOR CONGRESS
39726.27999999999,420,2020-08,C00650697,PETE STAUBER FOR CONGRESS
37281.06999999999,730,2020-07,C00547976,"BEN SASSE FOR U.S. SENATE, INC."
9808.000000000004,267,2020-07,C00558825,MILLER-MEEKS FOR CONGRESS
9692.440000000039,143,2020-07,C00670737,SINGH FOR SENATE
26903.790000000005,327,2020-07,C00722892,"SCHELLER FOR CONGRESS, INC."
51234.739999999154,2084,2020-07,C00545616,"YOUNG FOR IOWA, INC."
111241.07999999999,2123,2020-07,C00734731,FRIENDS FOR KATHY BARNETTE
71734.10000000175,3363,2020-09,C00371203,JOHN CARTER FOR CONGRESS
46930.30999999874,2247,2020-07,C00716498,ESTHER FOR CONGRESS
94764.76999999849,1885,2020-09,C00390476,CATHY MCMORRIS RODGERS FOR CONGRESS
31340.2,47,2020-09,C00668491,WILLIAM TIMMONS FOR CONGRESS
42311.50999999999,583,2020-09,C00699660,BISHOP FOR CONGRESS
31462.71000000064,1684,2020-07,C00495846,ANN WAGNER FOR CONGRESS
6800.0,12,2020-08,C00654723,MEUSER FOR CONGRESS
16207.0,53,2020-07,C00721365,DEVOLDER-SANTOS FOR CONGRESS
32138.5,195,2020-07,C00722454,DALE CRAFTS FOR CONGRESS
15163.240000000056,423,2020-07,C00708289,GREENE FOR CONGRESS
7767.999999999959,924,2020-07,C00653220,CAROL FOR CONGRESS
6403.75,15,2020-07,C00412890,ADRIAN SMITH FOR CONGRESS
23218.46,73,2020-07,C00662650,BALDERSON FOR CONGRESS
30739.06,116,2020-09,C00408534,BILIRAKIS FOR CONGRESS
31224.0,966,2020-09,C00496075,RAND PAUL FOR US SENATE
16776.0,70,2020-07,C00741090,DIANA FOR CONGRESS
98031.32999999399,6528,2020-09,C00728238,LAUREN BOEBERT FOR CONGRESS
265324.64000000677,8128,2020-07,C00705236,JOE COLLINS FOR CONGRESS
13010.0,34,2020-09,C00628917,FRIENDS OF DUSTY JOHNSON
32451.940000000868,2131,2020-08,C00614214,BERGMANFORCONGRESS
12230.0,13,2020-08,C00745794,JASON ROSS FOR CONGRESS
6224.889999999994,227,2020-09,C00723916,MARY MILLER FOR CONGRESS
20481.730000000385,728,2020-08,C00617662,CAPTAIN HIGGINS FOR CONGRESS
49315.84000000089,1090,2020-08,C00368522,JOE WILSON FOR CONGRESS
9802.0,21,2020-09,C00331397,SIMPSON FOR CONGRESS
13437.49999999964,2245,2020-07,C00467571,"ANDY BARR FOR CONGRESS, INC."
17032.0,189,2020-07,C00711572,BECCHI FOR CONGRESS
46682.07999999854,3463,2020-08,C00607416,BRIAN FITZPATRICK FOR CONGRESS
21335.5,170,2020-07,C00717868,HOUSE CD6
193626.98000000603,7782,2020-07,C00552547,ZELDIN FOR CONGRESS
4432.2,37,2020-09,C00681544,TED HOWZE FOR CONGRESS 2020
9025.0,10,2020-08,C00473132,MCKINLEY FOR CONGRESS
94077.95,1085,2020-08,C00721142,ANDREWS FOR CONGRESS
34114.69999999897,2060,2020-07,C00545749,EMMER FOR CONGRESS
62614.0,474,2020-09,C00711572,BECCHI FOR CONGRESS
35186.57,204,2020-07,C00730150,NEHLS FOR CONGRESS
13763.470000000001,48,2020-08,C00527457,FRIENDS OF DAVE JOYCE
99064.26000000212,4526,2020-07,C00701102,MIKE GARCIA FOR CONGRESS
9111.720000000001,18,2020-09,C00458679,BLAINE FOR CONGRESS
21444.140000000014,305,2020-09,C00501643,DAVID ROUZER FOR CONGRESS
7680.01,11,2020-08,C00331397,SIMPSON FOR CONGRESS
11089.95,61,2020-09,C00697789,JERRY CARL FOR CONGRESS
11618.0,155,2020-08,C00466482,FAMILIES FOR JAMES LANKFORD
5415.0,39,2020-08,C00573980,KELLY FOR CONGRESS
8283.0,68,2020-07,C00464032,TOM REED FOR CONGRESS
3920.0,17,2020-09,C00737387,TIMHAZELOFORCONGRESS
11323.0,221,2020-07,C00443218,WICKER FOR SENATE
12717.900000000001,142,2020-08,C00575050,LAHOOD FOR CONGRESS
59089.00999999916,1685,2020-08,C00666396,MICHAEL WALTZ FOR CONGRESS
25348.95,199,2020-08,C00697789,JERRY CARL FOR CONGRESS
13084.56,261,2020-09,C00548180,WESTERMAN FOR CONGRESS
6470.0,15,2020-07,C00723916,MARY MILLER FOR CONGRESS
41005.03999999955,902,2020-09,C00728386,DUDE PAC FOR FREEDOM
87200.33999999998,2853,2020-08,C00608398,JOHN KENNEDY FOR US
18850.0,31,2020-08,C00742106,LETLOW FOR CONGRESS
7195.6,97,2020-09,C00712257,CUMMINGS FOR CONGRESS
31176.370000000006,784,2020-07,C00728386,DUDE PAC FOR FREEDOM
20940.5,47,2020-08,C00504019,RICK W. ALLEN FOR CONGRESS
16807.660000000003,517,2020-08,C00720078,JAY OBERNOLTE FOR CONGRESS 2020
21936.0,192,2020-08,C00713537,FRIENDS OF JOHN EMMONS
7260.1,129,2020-08,C00541862,JASON SMITH FOR CONGRESS
24126.2,306,2020-08,C00744201,RAYLAFORCONGRESS
17989.0,33,2020-08,C00632067,RON ESTES FOR CONGRESS
15821.0,147,2020-09,C00746966,CAROLINE COLARUSSO FOR CONGRESS
28592.47999999999,347,2020-08,C00614776,TED BUDD FOR CONGRESS
61950.410000000316,2361,2020-08,C00545616,"YOUNG FOR IOWA, INC."
8719.47000000001,55,2020-08,C00734251,"STREICKER FOR CONGRESS, INC."
16300.0,10,2020-07,C00461822,"CHUCK FLEISCHMANN FOR CONGRESS COMMITTEE, INC."
59636.50000000001,1816,2020-07,C00608398,JOHN KENNEDY FOR US
6460.01,22,2020-08,C00729905,SIA LO FOR CONGRESS
10900.0,11,2020-08,C00738872,BLAKE MOORE FOR CONGRESS
19909.309999999998,2219,2020-07,C00301838,STEVE CHABOT FOR CONGRESS
3796.1800000000003,84,2020-08,C00540617,FRIENDS OF DAVID SCHWEIKERT
55704.9399999997,3311,2020-08,C00728238,LAUREN BOEBERT FOR CONGRESS
7687.0,65,2020-09,C00330886,MIKE CRAPO FOR US SENATE
11581.170000000002,42,2020-09,C00527457,FRIENDS OF DAVE JOYCE
51499.55999999822,4184,2020-07,C00607416,BRIAN FITZPATRICK FOR CONGRESS
42894.219999999994,1307,2020-07,C00675348,CINDY HYDE-SMITH FOR US SENATE
3120.0,13,2020-07,C00573980,KELLY FOR CONGRESS
189832.29000000004,7097,2020-08,C00620518,MARCO RUBIO FOR SENATE
7281.0,54,2020-07,C00677286,"STEIL FOR WISCONSIN, INC."
8580.21,168,2020-09,C00540617,FRIENDS OF DAVID SCHWEIKERT
25363.68000000003,360,2020-07,C00559393,DAN NEWHOUSE FOR CONGRESS
26136.69000000055,788,2020-09,C00497818,WENSTRUP FOR CONGRESS
9230.250000000007,116,2020-07,C00561530,MOOLENAAR FOR CONGRESS
18698.780000000002,195,2020-07,C00373001,CITIZENS FOR TURNER
11010.0,44,2020-09,C00504019,RICK W. ALLEN FOR CONGRESS
2970.0,8,2020-08,C00714378,IRENE ARMENDARIZ-JACKSON FOR CONGRESS
58344.42999999999,1422,2020-09,C00459255,"FRIENDS OF TODD YOUNG, INC."
76667.29999999753,2066,2020-07,C00390476,CATHY MCMORRIS RODGERS FOR CONGRESS
3170.01,13,2020-08,C00735852,NEGRON CAMPAIGN COMMITTEE
27125.30999999999,437,2020-07,C00699660,BISHOP FOR CONGRESS
280033.4800000095,11268,2020-09,C00665638,YOUNG KIM FOR CONGRESS
51851.67000000026,4818,2020-09,C00696872,JIM 2020 COMMITTEE
33407.39,312,2020-07,C00711010,"BOLDUC 2022, INC."
2800.0,1,2020-07,C00707679,FRICILONEFORCONGRESS
8654.0,221,2020-07,C00653147,MIKE BRAUN FOR INDIANA
6585.0,15,2020-07,C00733873,FRIENDS OF JAMES ST. GEORGE
6290.0,35,2020-09,C00743955,ELECT TUMAN
20526.33,76,2020-08,C00395467,JEFF FORTENBERRY FOR UNITED STATES CONGRESS
13843.89,22,2020-09,C00412890,ADRIAN SMITH FOR CONGRESS
10658.099999999997,391,2020-07,C00440362,JIM RISCH FOR U.S. SENATE COMMITTEE
7898.0,64,2020-07,C00608695,MIKE JOHNSON FOR LOUISIANA
12503.32,34,2020-07,C00393629,MCHENRY FOR CONGRESS
7092.84,60,2020-07,C00443580,LUMMIS FOR WYOMING INC.
23261.15,399,2020-07,C00666859,MARYOTT FOR CONGRESS
22971.91000000001,173,2020-09,C00734251,"STREICKER FOR CONGRESS, INC."
15641.74,108,2020-09,C00720011,SCOTT FITZGERALD FOR CONGRESS
3161.1900000000005,11,2020-08,C00726000,LEO VALENTIN FOR CONGRESS
6690.83,23,2020-08,C00723916,MARY MILLER FOR CONGRESS
5750.0,8,2020-09,C00445023,GUTHRIE FOR CONGRESS
67946.91,2096,2020-09,C00676965,RICK SCOTT FOR FLORIDA
11815.0,27,2020-08,C00582304,FRIENDS OF NEAL DUNN
4735.0,7,2020-09,C00468256,BUCSHON FOR CONGRESS
3100.0,6,2020-07,C00473132,MCKINLEY FOR CONGRESS
22428.0,199,2020-08,C00717868,HOUSE CD6
62716.83000000001,1709,2020-08,C00461046,FRIENDS OF PAT TOOMEY
10376.720000000001,25,2020-09,C00724849,DEBELLO FOR CONGRESS
2860.0,3,2020-09,C00749440,VESS FOR CONGRESS
17372.219999999998,259,2020-09,C00711010,"BOLDUC 2022, INC."
13726.0,81,2020-08,C00718346,KANSANS FOR LATURNER
2800.0,1,2020-08,C00749523,AARON HARRIS FOR CONGRESS
41261.66,1494,2020-08,C00376939,MARSHA FOR SENATE
14129.430000000018,659,2020-09,C00553859,DR. BRIAN BABIN FOR CONGRESS
14026.64000000005,697,2020-09,C00617662,CAPTAIN HIGGINS FOR CONGRESS
11716.150000000005,428,2020-08,C00443580,LUMMIS FOR WYOMING INC.
11316.900000000009,759,2020-08,C00497818,WENSTRUP FOR CONGRESS
77021.20999999999,3145,2020-08,C00492785,TED CRUZ FOR SENATE
50160.14,1548,2020-08,C00652727,JOSH HAWLEY FOR SENATE
9925.940000000004,101,2020-08,C00498345,MULLIN FOR CONGRESS
15209.0,151,2020-09,C00740449,MANGA FOR CONGRESS
72780.22999999949,2535,2020-07,C00492785,TED CRUZ FOR SENATE
8774.57,127,2020-09,C00498345,MULLIN FOR CONGRESS
45506.38,1689,2020-08,C00676965,RICK SCOTT FOR FLORIDA
11207.1,67,2020-07,C00459297,HUIZENGA FOR CONGRESS
5902.0999999999985,50,2020-08,C00359034,GRAVES FOR CONGRESS
17096.770000000004,177,2020-09,C00561530,MOOLENAAR FOR CONGRESS
12973.0,110,2020-07,C00739177,KEVIN O'CONNOR FOR U.S. SENATE INC.
51482.64000000002,1541,2020-08,C00730531,TEXANS FOR RONNY JACKSON
7460.0,16,2020-07,C00715698,"JEFF COLEMAN FOR CONGRESS, INC."
31791.340000000004,1076,2020-08,C00207993,FRIENDS OF JIM INHOFE
4082.579999999979,315,2020-09,C00721308,GOOD FOR CONGRESS
2824.2,19,2020-07,C00458679,BLAINE FOR CONGRESS
3069.5,30,2020-09,C00738302,LANCIA FOR CONGRESS
23075.199999999997,132,2020-09,C00633610,RALPH NORMAN FOR CONGRESS
12904.0,177,2020-08,C00746966,CAROLINE COLARUSSO FOR CONGRESS
29570.679999999924,3874,2020-07,C00371203,JOHN CARTER FOR CONGRESS
4930.0,27,2020-07,C00745570,FRIENDS OF JACKSON MAYNARD
23639.040000000343,958,2020-07,C00510164,PATRIOTS FOR PERRY
19461.660000000014,197,2020-09,C00412759,VERN BUCHANAN FOR CONGRESS
7020.0,157,2020-09,C00458315,MORAN FOR KANSAS
16349.2,292,2020-09,C00736983,"COLLINS FOR SENATE, INC."
15091.0,174,2020-09,C00372532,MICHAEL BURGESS FOR CONGRESS
3680.0,39,2020-09,C00546499,MIKE BOST FOR CONGRESS COMMITTEE
20471.07,483,2020-09,C00409581,FRIENDS OF JOHN THUNE
11631.260000000028,172,2020-08,C00412759,VERN BUCHANAN FOR CONGRESS
14703.0,89,2020-07,C00548180,WESTERMAN FOR CONGRESS
14599.880000000001,433,2020-08,C00304758,FRIENDS OF ROY BLUNT
6355.01,13,2020-08,C00468256,BUCSHON FOR CONGRESS
2025.0,2,2020-09,C00506048,TOM RICE FOR CONGRESS
12451.0,98,2020-07,C00729954,GARBARINO FOR CONGRESS
22540.239999999998,328,2020-07,C00650697,PETE STAUBER FOR CONGRESS
15008.97,480,2020-09,C00498907,DEB FISCHER FOR US SENATE
10460.0,20,2020-09,C00582304,FRIENDS OF NEAL DUNN
2580.0,13,2020-09,C00450353,FRIENDS OF PETER THERON
20483.82,696,2020-09,C00436386,FRIENDS OF JOHN BARRASSO
29435.90000000013,2765,2020-09,C00556365,KATKO FOR CONGRESS
2050.0,2,2020-09,C00473132,MCKINLEY FOR CONGRESS
3510.0,15,2020-08,C00735373,WINNFORCOLORADO
2275.0,15,2020-09,C00724245,GARCIA HOLMES FOR CONGRESS
10683.59000000005,323,2020-07,C00736108,EBBEN FOR WISCONSIN
6721.129999999991,148,2020-09,C00733170,CATHY BERNSTEIN FOR CONGRESS
6640.0,39,2020-08,C00313247,ROBERT ADERHOLT FOR CONGRESS
15000.0,10,2020-09,C00464073,FRIENDS OF SCOTT DESJARLAIS
2775.2,74,2020-09,C00662171,RON WRIGHT FOR CONGRESS
15879.409999999956,812,2020-08,C00653220,CAROL FOR CONGRESS
16954.0,170,2020-08,C00740449,MANGA FOR CONGRESS
13502.30000000003,728,2020-09,C00657833,GUY FOR CONGRESS
20122.600000000457,904,2020-09,C00458877,KINZINGER FOR CONGRESS
6350.27,47,2020-07,C00720011,SCOTT FITZGERALD FOR CONGRESS
2375.0,22,2020-09,C00461822,"CHUCK FLEISCHMANN FOR CONGRESS COMMITTEE, INC."
38622.079999998976,3975,2020-09,C00694711,MARCHANT FOR CONGRESS
19082.0,611,2020-07,C00436386,FRIENDS OF JOHN BARRASSO
87545.6600000003,5362,2020-07,C00661868,VAN DREW FOR CONGRESS
15259.419999999998,351,2020-07,C00614776,TED BUDD FOR CONGRESS
3850.0,4,2020-07,C00116632,HAL ROGERS FOR CONGRESS
10799.5,396,2020-08,C00496075,RAND PAUL FOR US SENATE
12089.2,121,2020-08,C00708073,RONDA KENNEDY FOR CONGRESS 2020
55031.11,1781,2020-09,C00376939,MARSHA FOR SENATE
6494.87,146,2020-09,C00481911,DANIEL WEBSTER FOR CONGRESS
39237.50000000001,1241,2020-09,C00482984,RON JOHNSON FOR SENATE INC
5826.96,83,2020-09,C00744201,RAYLAFORCONGRESS
10510.52,138,2020-09,C00739581,THE BILLY PREMPEH FOR CONGRESS COMMITTEE
3741.62,41,2020-08,C00728790,CLAIRE GUSTAFSON FOR CONGRESS 2020
11338.189999999975,1005,2020-08,C00663914,DEBBIE LESKO FOR CONGRESS
2000.0,3,2020-08,C00668491,WILLIAM TIMMONS FOR CONGRESS
43300.7499999991,2924,2020-07,C00392688,"MCCAUL FOR CONGRESS, INC"
2965.0,23,2020-07,C00697789,JERRY CARL FOR CONGRESS
15625.68,341,2020-08,C00736983,"COLLINS FOR SENATE, INC."
1871.2399999999998,21,2020-07,C00417063,"WEST VIRGINIA REPUBLICAN PARTY, INC."
3885.0,21,2020-07,C00741561,CONSTITUTIONAL WARRIORS
2469.2100000000005,82,2020-08,C00614826,KUSTOFF FOR CONGRESS
10390.900000000005,327,2020-07,C00737767,VICTORIA SPARTZ FOR CONGRESS
20558.88,193,2020-07,C00721027,FOSTER FOR KANSAS
149650.80000000005,2548,2020-08,C00716571,"GADE FOR VIRGINIA, INC."
2120.0,25,2020-09,C00313247,ROBERT ADERHOLT FOR CONGRESS
3710.630000000001,24,2020-07,C00628917,FRIENDS OF DUSTY JOHNSON
13839.849999999999,388,2020-09,C00443218,WICKER FOR SENATE
1000.0,1,2020-09,C00734640,FRIENDS OF KERRY W. GIBSON
1225.0,5,2020-07,C00572602,DAVE GILES FOR CONGRESS
2250.0,6,2020-07,C00588657,TEXANS FOR JODEY ARRINGTON
21858.329999999663,2218,2020-07,C00012229,ALASKANS FOR DON YOUNG
8926.0,194,2020-07,C00372532,MICHAEL BURGESS FOR CONGRESS
5200.0,62,2020-08,C00737650,VAN DE WATER FOR CONGRESS
3670.0,13,2020-07,C00468256,BUCSHON FOR CONGRESS
7142.2,135,2020-07,C00719864,ERROL WEBBER FOR CONGRESS
9674.5,351,2020-08,C00409581,FRIENDS OF JOHN THUNE
20736.200000000004,202,2020-08,C00390724,WALBERG FOR CONGRESS
5472.0,73,2020-07,C00740449,MANGA FOR CONGRESS
12943.27,336,2020-09,C00607838,DREW FERGUSON FOR CONGRESS INC.
1226.0,5,2020-09,C00736074,BECKY E. HITES FOR CONGRESS COMMITTEE
1854.0,19,2020-09,C00417063,"WEST VIRGINIA REPUBLICAN PARTY, INC."
1502.0,9,2020-09,C00588764,COMER FOR CONGRESS
7393.34,82,2020-09,C00608695,MIKE JOHNSON FOR LOUISIANA
4782.0,118,2020-07,C00466482,FAMILIES FOR JAMES LANKFORD
10457.470000000001,109,2020-08,C00662650,BALDERSON FOR CONGRESS
3167.31,115,2020-07,C00670695,ROMNEY FOR UTAH INC
7375.41,107,2020-07,C00633610,RALPH NORMAN FOR CONGRESS
1251.0,3,2020-07,C00445023,GUTHRIE FOR CONGRESS
3767.0,42,2020-07,C00737650,VAN DE WATER FOR CONGRESS
13592.92,470,2020-07,C00482984,RON JOHNSON FOR SENATE INC
29938.41,661,2020-08,C00666859,MARYOTT FOR CONGRESS
7531.200000000001,103,2020-09,C00658385,MARK GREEN FOR CONGRESS
12239.339999999624,2188,2020-08,C00558825,MILLER-MEEKS FOR CONGRESS
9271.26,119,2020-09,C00737650,VAN DE WATER FOR CONGRESS
7865.5,219,2020-07,C00501643,DAVID ROUZER FOR CONGRESS
75271.29999999999,3155,2020-07,C00711432,ERIC EARLY FOR CONGRESS 2020
9526.95,243,2020-08,C00607838,DREW FERGUSON FOR CONGRESS INC.
13904.2,269,2020-07,C00744201,RAYLAFORCONGRESS
31349.1,678,2020-08,C00458463,PORTMAN FOR SENATE COMMITTEE
1035.0,3,2020-07,C00744888,COMMITTEE TO ELECT JULIE HALL
11364.0,405,2020-09,C00653147,MIKE BRAUN FOR INDIANA
17293.78,592,2020-08,C00727164,CARLA SPALDING FOR CONGRESS
4414.47,93,2020-08,C00461806,PAUL GOSAR FOR CONGRESS
11026.0,68,2020-08,C00543967,BUDDY CARTER FOR CONGRESS
7688.040000000001,74,2020-07,C00713537,FRIENDS OF JOHN EMMONS
5120.01,14,2020-08,C00733873,FRIENDS OF JAMES ST. GEORGE
8349.679999999982,313,2020-08,C00653634,VAN TAYLOR CAMPAIGN
9714.730000000001,289,2020-08,C00501643,DAVID ROUZER FOR CONGRESS
1377.3999999999999,25,2020-07,C00470757,VOTETIPTON.COM
2487.5,23,2020-08,C00639096,BARRY MOORE FOR CONGRESS
39445.14,1532,2020-07,C00652727,JOSH HAWLEY FOR SENATE
1750.0,7,2020-07,C00746388,TRACE JOHANNESEN FOR CONGRESS TX-04
1000.0,1,2020-08,C00551374,GARY PALMER FOR CONGRESS
3550.0,11,2020-07,C00735449,FRIENDS OF SUSAN MARIE SMITH
4170.0,23,2020-07,C00504019,RICK W. ALLEN FOR CONGRESS
43743.369999999995,431,2020-07,C00726596,YUKONG ZHAO FOR CONGRESS
5903.5,67,2020-08,C00732727,DASHA FOR CONGRESS
6602.0,280,2020-08,C00653147,MIKE BRAUN FOR INDIANA
21556.539999999997,796,2020-08,C00482984,RON JOHNSON FOR SENATE INC
12301.59,165,2020-09,C00446815,MCCLINTOCK FOR CONGRESS
30127.91,1193,2020-09,C00207993,FRIENDS OF JIM INHOFE
4628.799999999994,144,2020-09,C00653634,VAN TAYLOR CAMPAIGN
43719.57,1565,2020-09,C00532465,ROUNDS FOR SENATE
1000.0,1,2020-08,C00734640,FRIENDS OF KERRY W. GIBSON
8491.200000000004,60,2020-09,C00738013,FRIENDS OF JEFF JORDAN
27127.45999999992,3891,2020-07,C00200584,UPTON FOR ALL OF US
2943.0,27,2020-09,C00096412,FRIENDS OF CHRIS SMITH
5545.200000000001,49,2020-07,C00541862,JASON SMITH FOR CONGRESS
1600.0,3,2020-07,C00668491,WILLIAM TIMMONS FOR CONGRESS
3331.750000000006,118,2020-07,C00639096,BARRY MOORE FOR CONGRESS
3109.799999999964,576,2020-09,C00464602,VICKY HARTZLER FOR CONGRESS
5033.33,10,2020-08,C00412890,ADRIAN SMITH FOR CONGRESS
1825.0,17,2020-08,C00738302,LANCIA FOR CONGRESS
7350.0,282,2020-08,C00443218,WICKER FOR SENATE
2625.0,14,2020-08,C00734426,GREGORY COLL FOR CONGRESS
6585.0,49,2020-08,C00741090,DIANA FOR CONGRESS
3952.5,53,2020-07,C00096412,FRIENDS OF CHRIS SMITH
1240.0,7,2020-08,C00714907,OLA FOR CONGRESS
6474.0,125,2020-08,C00577999,"JIM BANKS FOR CONGRESS, INC."
3245.0,18,2020-09,C00735449,FRIENDS OF SUSAN MARIE SMITH
1351.0,13,2020-09,C00714907,OLA FOR CONGRESS
11976.650000000003,122,2020-08,C00633610,RALPH NORMAN FOR CONGRESS
2325.0,5,2020-08,C00725366,SCOTTY ROBINSON FOR CONGRESS
6571.67,120,2020-08,C00582635,JO RAE PERKINS FOR US SENATE
11898.5,117,2020-08,C00446815,MCCLINTOCK FOR CONGRESS
8155.0,109,2020-09,C00709584,GOMURPH.COM
3924.7899999999872,435,2020-07,C00497818,WENSTRUP FOR CONGRESS
35690.5,1283,2020-07,C00676965,RICK SCOTT FOR FLORIDA
12131.84,295,2020-08,C00707059,TRE PENNIE FOR CONGRESS
1800.2,9,2020-08,C00743153,BOB HAMILTON FOR KANSAS INC.
5030.0,115,2020-08,C00719252,JESSI MELTON FOR CONGRESS
4361.28,53,2020-09,C00664581,JAIMY Z. BLANCO FOR CONGRESS CAMPAIGN
1515.0,8,2020-09,C00727594,MCGUIRE FOR VIRGINIA
18178.56,742,2020-09,C00440362,JIM RISCH FOR U.S. SENATE COMMITTEE
5065.0,40,2020-08,C00703835,COMMITTEE TO ELECT JOHN COLLICK
2647.5,25,2020-08,C00682179,JOSHUA SCOTT FOR CONGRESS
5886.0,128,2020-09,C00466482,FAMILIES FOR JAMES LANKFORD
2810.0,16,2020-07,C00734087,RUDEN FOR CONGRESS
10335.2,150,2020-09,C00461806,PAUL GOSAR FOR CONGRESS
7375.0,95,2020-08,C00548180,WESTERMAN FOR CONGRESS
3580.3999999999314,899,2020-07,C00468579,WALORSKI FOR CONGRESS INC
8470.22999999999,508,2020-07,C00657833,GUY FOR CONGRESS
1000.0,1,2020-07,C00582304,FRIENDS OF NEAL DUNN
2280.1,19,2020-08,C00458679,BLAINE FOR CONGRESS
5245.0,62,2020-09,C00703835,COMMITTEE TO ELECT JOHN COLLICK
18845.4,531,2020-09,C00727164,CARLA SPALDING FOR CONGRESS
3431.16,31,2020-08,C00681544,TED HOWZE FOR CONGRESS 2020
3546.49999999995,819,2020-08,C00464602,VICKY HARTZLER FOR CONGRESS
1461.18,29,2020-08,C00705954,ALASKA SENATE REPUBLICAN NOMINEE FUND - DAN SULLIVAN
4024.510000000027,423,2020-07,C00694711,MARCHANT FOR CONGRESS
2584.4599999999996,68,2020-08,C00386532,LOUIE GOHMERT FOR CONGRESS COMMITTEE
5633.33,208,2020-07,C00498907,DEB FISCHER FOR US SENATE
1750.0,4,2020-09,C00588657,TEXANS FOR JODEY ARRINGTON
1005.0,2,2020-07,C00669614,TRACY LOVVORN FOR CONGRESS
20504.179999999997,817,2020-07,C00532465,ROUNDS FOR SENATE
6167.520000000029,458,2020-07,C00553859,DR. BRIAN BABIN FOR CONGRESS
1000.0,1,2020-07,C00734640,FRIENDS OF KERRY W. GIBSON
18310.769999999753,2642,2020-07,C00556365,KATKO FOR CONGRESS
2266.6800000000003,10,2020-08,C00724849,DEBELLO FOR CONGRESS
13921.11,491,2020-09,C00720078,JAY OBERNOLTE FOR CONGRESS 2020
10580.0,88,2020-08,C00736108,EBBEN FOR WISCONSIN
2715.0,31,2020-07,C00700823,SANDRA FOR TEXAS
3778.5,30,2020-09,C00734426,GREGORY COLL FOR CONGRESS
23357.95,829,2020-08,C00436386,FRIENDS OF JOHN BARRASSO
1245.0,15,2020-09,C00702415,SHEDD FOR AZ-01
6106.01,163,2020-07,C00736983,"COLLINS FOR SENATE, INC."
24627.330000000395,1364,2020-07,C00721332,DARRELL ISSA FOR CONGRESS
11299.700000000012,285,2020-07,C00722108,ADRIENNE FOR CONGRESS
5840.9700000000985,530,2020-08,C00458877,KINZINGER FOR CONGRESS
1080.0,5,2020-07,C00727958,"KATE FOR NJ, INC"
32340.289999999983,1198,2020-09,C00230482,"GRASSLEY COMMITTEE, INC."
5095.249999999962,972,2020-07,C00386748,VIRGINIA FOXX FOR CONGRESS
1140.0,9,2020-08,C00572602,DAVE GILES FOR CONGRESS
1825.0,13,2020-07,C00737387,TIMHAZELOFORCONGRESS
22734.59,886,2020-08,C00230482,"GRASSLEY COMMITTEE, INC."
2390.5999999999995,16,2020-08,C00444620,FRIENDS OF GLENN THOMPSON
2390.0,19,2020-08,C00735449,FRIENDS OF SUSAN MARIE SMITH
9157.160000000005,745,2020-08,C00553859,DR. BRIAN BABIN FOR CONGRESS
3070.2,89,2020-09,C00610451,BIGGS FOR CONGRESS
6990.0,65,2020-09,C00732727,DASHA FOR CONGRESS
1062.0,16,2020-09,C00741215,KANDISS TAYLOR FOR U.S. SENATE
2160.0,18,2020-08,C00608695,MIKE JOHNSON FOR LOUISIANA
1804.0,10,2020-08,C00719278,CLIFFORD FOR CONGRESS
770.6799999999998,16,2020-08,C00660050,COMMITTEE TO RE-ELECT STEVE WATKINS
2368.2499999999977,90,2020-08,C00706374,TAMIKA HAMILTON FOR CONGRESS
1650.0,7,2020-09,C00736108,EBBEN FOR WISCONSIN
2300.0,20,2020-09,C00573980,KELLY FOR CONGRESS
9112.2,186,2020-08,C00711325,KOBACH FOR SENATE
1027.24,27,2020-07,C00055582,NY REPUBLICAN FEDERAL CAMPAIGN COMMITTEE
9513.2,145,2020-09,C00582635,JO RAE PERKINS FOR US SENATE
600.0,2,2020-08,C00750133,MILLER 4 SENATE 2020
510.0,2,2020-08,C00721126,KNAGGS FOR CONGRESS
12337.95,241,2020-07,C00726687,PAUL JUNGE FOR CONGRESS
1343.0,16,2020-09,C00651547,JOHNNY FOR CONGRESS
2668.0,20,2020-07,C00715532,JAY ALLEN FOR MAINE
1935.5,12,2020-07,C00734517,"JOHN COWAN FOR CONGRESS, INC."
2271.3900000000003,52,2020-09,C00658401,GREG PENCE FOR CONGRESS
528.45,7,2020-09,C00438697,LATTA FOR CONGRESS
20479.929999999997,728,2020-07,C00230482,"GRASSLEY COMMITTEE, INC."
3345.0,33,2020-07,C00703835,COMMITTEE TO ELECT JOHN COLLICK
2527.5,39,2020-09,C00682179,JOSHUA SCOTT FOR CONGRESS
711.0,11,2020-07,C00664581,JAIMY Z. BLANCO FOR CONGRESS CAMPAIGN
2544.58,103,2020-07,C00705756,MICHIGAN SENATE REPUBLICAN NOMINEE FUND - JOHN JAMES
1521.73,18,2020-09,C00460063,BILLY LONG FOR CONGRESS
47197.969999999994,1920,2020-09,C00588392,TODOS CON JENNIFFER INC.  DBA JENNIFFER FOR CONGRESS
11068.580000000033,770,2020-08,C00657833,GUY FOR CONGRESS
7399.5,257,2020-07,C00409581,FRIENDS OF JOHN THUNE
16958.960000000086,495,2020-08,C00733170,CATHY BERNSTEIN FOR CONGRESS
5572.459999999997,118,2020-07,C00412759,VERN BUCHANAN FOR CONGRESS
600.0,2,2020-07,C00731943,CRUMPACKER FOR CONGRESS
15222.210000000086,768,2020-07,C00662767,CHIP ROY FOR CONGRESS
6630.0,290,2020-08,C00473371,HOEVEN FOR SENATE
19631.260000000002,793,2020-07,C00207993,FRIENDS OF JIM INHOFE
2120.519999999976,557,2020-09,C00468579,WALORSKI FOR CONGRESS INC
600.0,2,2020-08,C00731943,CRUMPACKER FOR CONGRESS
