total_raised,total_contributions,date,committee,committee_name
90671.0,784,2020-02,C00730507,KNUTE FOR CONGRESS
37008.38999999998,97,2020-03,C00576173,KANSANS FOR MARSHALL
14449.74,165,2020-02,C00701433,CHELE FARLEY FOR CONGRESS INC.
69431.59999999999,58,2020-02,C00734251,"STREICKER FOR CONGRESS, INC."
28814.0,199,2020-03,C00741090,DIANA FOR CONGRESS
257927.62999999998,3513,2020-02,C00545772,THOM TILLIS COMMITTEE
119127.39,1676,2020-02,C00547570,PERDUE FOR SENATE
52535.0,63,2020-03,C00732149,RENEE SWANN FOR CONGRESS
43145.0,79,2020-02,C00719294,AUGUST PFLUGER FOR CONGRESS
447069.46999999986,13638,2020-02,C00546788,JONI FOR IOWA
48587.0,158,2020-01,C00718627,TEAM HAGERTY
373982.7200000008,5085,2020-03,C00491357,STEVE DAINES FOR MONTANA
518581.55999999994,18607,2020-03,C00458828,"TEAM GRAHAM, INC."
28766.80000000001,126,2020-01,C00545616,"YOUNG FOR IOWA, INC."
29870.5,45,2020-03,C00575050,LAHOOD FOR CONGRESS
6740730.340000024,157873,2020-02,C00580100,"DONALD J. TRUMP FOR PRESIDENT, INC."
57983.0,72,2020-01,C00730168,PIERCE BUSH FOR CONGRESS
75939.0,140,2020-03,C00734491,MOWERS FOR CONGRESS
24146.0,23,2020-01,C00732149,RENEE SWANN FOR CONGRESS
18355.0,29,2020-01,C00658401,GREG PENCE FOR CONGRESS
17605.0,32,2020-01,C00732107,DRISCOLL FOR CONGRESS
271231.0200000001,3428,2020-01,C00314575,COLLINS FOR SENATOR
38628.2,907,2020-01,C00729608,GEORGIANS FOR KELLY LOEFFLER
4540089.770000017,108952,2020-01,C00580100,"DONALD J. TRUMP FOR PRESIDENT, INC."
301129.09000000055,6443,2020-01,C00369033,TEXANS FOR SENATOR JOHN CORNYN INC.
53865.399999999994,49,2020-02,C00733873,FRIENDS OF JAMES ST. GEORGE
24421.200000000004,20,2020-02,C00668491,WILLIAM TIMMONS FOR CONGRESS
597132.71,16468,2020-03,C00666040,MCSALLY FOR SENATE INC
116990.23999999996,859,2020-02,C00570994,ALASKANS FOR DAN SULLIVAN
32605.32000000004,628,2020-03,C00392688,"MCCAUL FOR CONGRESS, INC"
28796.28,105,2020-02,C00638411,HAGAN FOR CONGRESS
450519.1199999996,8636,2020-02,C00492454,CORY GARDNER FOR SENATE
48724.659999999974,340,2020-03,C00200584,UPTON FOR ALL OF US
16355.0,19,2020-02,C00498121,ROGER WILLIAMS FOR U S CONGRESS COMMITTEE
63092.39999999999,3412,2020-03,C00712190,SCHERIE MURRAY FOR CONGRESS
14392.0,75,2020-01,C00441014,ROB WITTMAN FOR CONGRESS
28693.51000000002,318,2020-02,C00467571,"ANDY BARR FOR CONGRESS, INC."
15855.0,21,2020-02,C00739177,KEVIN O'CONNOR FOR U.S. SENATE INC.
67159.04999999999,723,2020-03,C00671859,MARIA ELVIRA SALAZAR FOR CONGRESS
75890.92999999998,1196,2020-02,C00704981,MICHELLE STEEL FOR CONGRESS
42824.05999999754,1663,2020-02,C00495846,ANN WAGNER FOR CONGRESS
16161.249999999987,324,2020-02,C00200584,UPTON FOR ALL OF US
20175.0,29,2020-01,C00732693,SANCHEZ FOR NEW MEXICO
21973.08,36,2020-02,C00735985,CARLOS GIMENEZ FOR CONGRESS
17824.0,26,2020-02,C00632067,RON ESTES FOR CONGRESS
41547.780000000006,211,2020-02,C00714865,BETH VAN DUYNE FOR CONGRESS
326481.80000000005,7077,2020-03,C00492454,CORY GARDNER FOR SENATE
79661.09999999996,450,2020-02,C00306704,FRIENDS OF SESSIONS SENATE COMMITTEE INC
22119.189999999955,113,2020-02,C00497818,WENSTRUP FOR CONGRESS
29667.060000000005,265,2020-03,C00614214,BERGMANFORCONGRESS
9332.390000000005,92,2020-02,C00373001,CITIZENS FOR TURNER
77503.01999999997,1213,2020-02,C00670695,ROMNEY FOR UTAH INC
9025.0,15,2020-02,C00629949,ALEX MOONEY FOR CONGRESS
54485.399999999994,980,2020-03,C00726570,OMARI FAULKNER FOR VIRGINIA
27835.4,65,2020-03,C00714089,SARA HART WEIR FOR CONGRESS
66712.93999999999,176,2020-03,C00715235,COLLINS FOR TEXAS
667747.2499999998,20245,2020-03,C00546788,JONI FOR IOWA
84097.73999999999,795,2020-03,C00570994,ALASKANS FOR DAN SULLIVAN
5537390.390000012,133710,2020-03,C00580100,"DONALD J. TRUMP FOR PRESIDENT, INC."
18500.0,72,2020-03,C00722454,DALE CRAFTS FOR CONGRESS
13805.339999999998,90,2020-02,C00510164,PATRIOTS FOR PERRY
234966.74000000005,7609,2020-03,C00716860,JASON LEWIS FOR SENATE
45235.0,71,2020-03,C00657155,TIFFANY SHEDD FOR CONGRESS COMMITTEE
195147.9899999999,2947,2020-03,C00545772,THOM TILLIS COMMITTEE
36392.0,92,2020-02,C00732107,DRISCOLL FOR CONGRESS
11584.460000000003,34,2020-02,C00711572,BECCHI FOR CONGRESS
35415.03,187,2020-03,C00733329,BYRON DONALDS FOR CONGRESS
47599.0,592,2020-02,C00733469,MARK RONCHETTI FOR NEW MEXICO
36842.94999999973,381,2020-02,C00725853,BURGESS 4 UTAH
34767.05,244,2020-02,C00726570,OMARI FAULKNER FOR VIRGINIA
12368.880000000003,104,2020-02,C00717959,FISCHBACH FOR CONGRESS
103593.50999999998,1950,2020-03,C00547570,PERDUE FOR SENATE
333468.9199999998,7244,2020-02,C00369033,TEXANS FOR SENATOR JOHN CORNYN INC.
13588.93999999999,254,2020-03,C00301838,STEVE CHABOT FOR CONGRESS
35668.0,70,2020-02,C00715698,"JEFF COLEMAN FOR CONGRESS, INC."
741201.3700000003,23785,2020-03,C00420935,KEVIN MCCARTHY FOR CONGRESS
105480.86999999998,4391,2020-02,C00665638,YOUNG KIM FOR CONGRESS
21318.86,26,2020-03,C00629949,ALEX MOONEY FOR CONGRESS
105445.3,1524,2020-03,C00736983,"COLLINS FOR SENATE, INC."
11630.26,68,2020-02,C00408534,BILIRAKIS FOR CONGRESS
10575.0,24,2020-03,C00729996,RANDY HENDERSON FOR CONGRESS
16410.0,21,2020-02,C00732768,LIPETRI FOR CONGRESS
80844.73000000001,2206,2020-02,C00499988,"COTTON FOR SENATE, INC."
21575.0,13,2020-03,C00729913,FORD FOR FLORIDA
33443.0,418,2020-02,C00470757,VOTETIPTON.COM
39895.96000000001,390,2020-03,C00547976,"BEN SASSE FOR U.S. SENATE, INC."
21755.0,13,2020-03,C00393629,MCHENRY FOR CONGRESS
17005.0,5,2020-02,C00741256,TRENT CHRISTENSEN FOR CONGRESS
31147.580000000027,626,2020-01,C00371203,JOHN CARTER FOR CONGRESS
23529.900000000023,471,2020-03,C00521948,RODNEY FOR CONGRESS
14125.0,8,2020-03,C00331397,SIMPSON FOR CONGRESS
48975.0,88,2020-02,C00717322,RODIMER FOR CONGRESS
18038.8,200,2020-01,C00733394,TAYLOR FOR CONGRESS 2020
20614.0,33,2020-03,C00632067,RON ESTES FOR CONGRESS
1034543.6200000026,30805,2020-01,C00193342,MCCONNELL SENATE COMMITTEE
106320.0,793,2020-01,C00730507,KNUTE FOR CONGRESS
59007.0,509,2020-01,C00733329,BYRON DONALDS FOR CONGRESS
22464.0,73,2020-01,C00730531,TEXANS FOR RONNY JACKSON
24697.800000000007,112,2020-01,C00306704,FRIENDS OF SESSIONS SENATE COMMITTEE INC
73970.0,173,2020-03,C00739177,KEVIN O'CONNOR FOR U.S. SENATE INC.
1313363.18,37424,2020-03,C00394957,SCALISE FOR CONGRESS
33513.84,89,2020-01,C00576173,KANSANS FOR MARSHALL
25234.0,60,2020-03,C00464032,TOM REED FOR CONGRESS
27118.210000000003,755,2020-03,C00539825,CAPITO FOR WEST VIRGINIA
21114.56,25,2020-03,C00720870,JESSE JENSEN FOR CONGRESS
38838.590000000004,276,2020-03,C00694778,NICOLE FOR NEW YORK
460501.04000000015,12737,2020-03,C00370056,DEVIN NUNES CAMPAIGN COMMITTEE
42087.58,180,2020-03,C00718635,"TIFFANY FOR WISCONSIN, INC."
15936.5,34,2020-01,C00717959,FISCHBACH FOR CONGRESS
26747.08,128,2020-03,C00701433,CHELE FARLEY FOR CONGRESS INC.
27356.950000000015,307,2020-03,C00467571,"ANDY BARR FOR CONGRESS, INC."
31002.949999999997,861,2020-01,C00675348,CINDY HYDE-SMITH FOR US SENATE
7860.0,4,2020-01,C00730689,JOHNNY PRESLEY FOR US SENATE
15335.0,20,2020-01,C00629949,ALEX MOONEY FOR CONGRESS
23822.73,145,2020-01,C00711010,"BOLDUC 2022, INC."
25801.8,351,2020-01,C00729335,FRIENDS OF NICK FREITAS INC
13116.75,278,2020-01,C00304758,FRIENDS OF ROY BLUNT
344232.540000001,10101,2020-01,C00546788,JONI FOR IOWA
16781.0,15,2020-02,C00575050,LAHOOD FOR CONGRESS
42591.469999999994,1448,2020-02,C00620518,MARCO RUBIO FOR SENATE
7819.5,29,2020-01,C00726687,PAUL JUNGE FOR CONGRESS
29141.94000000008,407,2020-01,C00725853,BURGESS 4 UTAH
40775.99999999993,104,2020-02,C00576173,KANSANS FOR MARSHALL
18167.0,180,2020-01,C00724914,AMERICANS FOR PARNELL COMMITTEE
10805.0,29,2020-02,C00732693,SANCHEZ FOR NEW MEXICO
1206908.8399999994,37232,2020-02,C00420935,KEVIN MCCARTHY FOR CONGRESS
30952.0,111,2020-03,C00722553,SHANE HERNANDEZ FOR CONGRESS
243054.2099999999,5263,2020-03,C00369033,TEXANS FOR SENATOR JOHN CORNYN INC.
27575.0,22,2020-03,C00734640,FRIENDS OF KERRY W. GIBSON
24977.669999999987,246,2020-03,C00699660,BISHOP FOR CONGRESS
8000.0,4,2020-02,C00735019,CHELLE FOR CONGRESS
42020.0,266,2020-02,C00697417,"BYRNE FOR SENATE, INC."
1197149.2799999998,36078,2020-01,C00394957,SCALISE FOR CONGRESS
61731.0,117,2020-03,C00735688,BOGNET FOR CONGRESS
43143.2,164,2020-01,C00734491,MOWERS FOR CONGRESS
111886.61000000015,2360,2020-01,C00545772,THOM TILLIS COMMITTEE
40463.50000000002,381,2020-02,C00547976,"BEN SASSE FOR U.S. SENATE, INC."
16673.0,294,2020-03,C00409581,FRIENDS OF JOHN THUNE
9318.19,170,2020-02,C00706051,DR. LISA SPARKS FOR CONGRESS
2167454.259999999,60613,2020-02,C00394957,SCALISE FOR CONGRESS
23434.0,373,2020-02,C00711077,LISA SONG SUTTON FOR CONGRESS
26585.879999999976,253,2020-02,C00716498,ESTHER FOR CONGRESS
54856.09,95,2020-03,C00708263,AMANDA MAKKI FOR CONGRESS
18517.169999999995,220,2020-02,C00561183,TENNEY FOR CONGRESS
31853.96,606,2020-02,C00716597,CATALINA FOR CONGRESS COMMITTEE
6005.0,18,2020-03,C00735811,STEFAN FOR CONGRESS
62220.15,1213,2020-02,C00543983,BILL CASSIDY FOR US SENATE
61749.14000000001,744,2020-02,C00694778,NICOLE FOR NEW YORK
9361.0,19,2020-01,C00459297,HUIZENGA FOR CONGRESS
24542.0,35,2020-03,C00715698,"JEFF COLEMAN FOR CONGRESS, INC."
11690.16,164,2020-03,C00561183,TENNEY FOR CONGRESS
17340.0,277,2020-02,C00436386,FRIENDS OF JOHN BARRASSO
15186.93,184,2020-03,C00724914,AMERICANS FOR PARNELL COMMITTEE
30354.59000000006,253,2020-03,C00012229,ALASKANS FOR DON YOUNG
31786.68000000002,480,2020-02,C00371203,JOHN CARTER FOR CONGRESS
16636.0,25,2020-01,C00723437,"EISEN FOR CONGRESS, INC."
14740.0,19,2020-03,C00721571,DR. CHUCK FOR CONGRESS
16110.0,42,2020-03,C00697789,JERRY CARL FOR CONGRESS
18525.0,100,2020-03,C00736108,EBBEN FOR WISCONSIN
15795.62,98,2020-02,C00650697,PETE STAUBER FOR CONGRESS
36206.640000000014,728,2020-03,C00718627,TEAM HAGERTY
26348.13,292,2020-03,C00711325,KOBACH FOR SENATE
10487.94000000042,1611,2020-03,C00653220,CAROL FOR CONGRESS
21903.099999998783,1778,2020-03,C00607556,LIZ CHENEY FOR WYOMING
16527.0,317,2020-03,C00470757,VOTETIPTON.COM
33370.2,34,2020-03,C00733873,FRIENDS OF JAMES ST. GEORGE
50680.0,60,2020-03,C00742106,LETLOW FOR CONGRESS
22086.22999999996,77,2020-03,C00617662,CAPTAIN HIGGINS FOR CONGRESS
23370.31000000001,105,2020-02,C00710103,NANCY MACE FOR CONGRESS
44461.0,159,2020-03,C00727594,MCGUIRE FOR VIRGINIA
7075.0,13,2020-03,C00608695,MIKE JOHNSON FOR LOUISIANA
38977.74999999983,288,2020-03,C00725853,BURGESS 4 UTAH
11341.0,117,2020-03,C00721142,ANDREWS FOR CONGRESS
24720.0,59,2020-03,C00717330,FRIENDS OF KELLY MITCHELL
35086.0,45,2020-03,C00742247,SCOTT FRANKLIN FOR CONGRESS
14695.600000000002,55,2020-03,C00704064,NEESE FOR CONGRESS
13217.3,97,2020-03,C00722892,"SCHELLER FOR CONGRESS, INC."
13347.5,23,2020-03,C00727958,"KATE FOR NJ, INC"
25146.0,163,2020-02,C00733329,BYRON DONALDS FOR CONGRESS
8404.0,44,2020-03,C00446815,MCCLINTOCK FOR CONGRESS
12046.0,22,2020-02,C00735811,STEFAN FOR CONGRESS
16313.400000000001,323,2020-02,C00701102,MIKE GARCIA FOR CONGRESS
16175.38,119,2020-03,C00717306,CLAIRE CHASE FOR CONGRESS
107072.09999999998,1986,2020-03,C00718239,ANNA PAULINA LUNA FOR CONGRESS
28700.71,296,2020-02,C00733394,TAYLOR FOR CONGRESS 2020
3400.0,6,2020-02,C00694687,TAYLOR FOR CONGRESS
44116.0,165,2020-02,C00734491,MOWERS FOR CONGRESS
77379.98,323,2020-03,C00306704,FRIENDS OF SESSIONS SENATE COMMITTEE INC
18245.0,17,2020-02,C00721092,"DAVID HILL FOR OKLAHOMA, INC."
23476.209999999955,247,2020-02,C00723759,"JESSICA TAYLOR FOR CONGRESS, INC."
10036.400000000005,146,2020-02,C00722108,ADRIENNE FOR CONGRESS
38428.5,503,2020-03,C00633362,"HANDEL FOR CONGRESS, INC."
26581.430000000004,87,2020-03,C00545616,"YOUNG FOR IOWA, INC."
89583.12999999999,2085,2020-02,C00716860,JASON LEWIS FOR SENATE
20181.0,54,2020-03,C00711572,BECCHI FOR CONGRESS
15939.0,82,2020-02,C00464032,TOM REED FOR CONGRESS
30474.45,405,2020-02,C00729335,FRIENDS OF NICK FREITAS INC
7400.0,12,2020-02,C00721571,DR. CHUCK FOR CONGRESS
21277.520000000008,338,2020-02,C00671859,MARIA ELVIRA SALAZAR FOR CONGRESS
51112.99999999781,1831,2020-03,C00495846,ANN WAGNER FOR CONGRESS
48540.55,1473,2020-03,C00661868,VAN DREW FOR CONGRESS
3200.0,4,2020-02,C00706275,PALLOTTA FOR CONGRESS
13245.0,85,2020-02,C00717876,AMANDA ADKINS FOR CONGRESS
39075.49,312,2020-03,C00701003,HUNT FOR CONGRESS
59491.92,669,2020-03,C00706614,TONY GONZALES FOR CONGRESS
113176.59999999999,4019,2020-03,C00711689,LACY JOHNSON FOR CONGRESS
13459.64,197,2020-03,C00717322,RODIMER FOR CONGRESS
8367.0,26,2020-02,C00393629,MCHENRY FOR CONGRESS
53072.959999999955,1344,2020-02,C00416594,JIM JORDAN FOR CONGRESS
23474.5,171,2020-02,C00718635,"TIFFANY FOR WISCONSIN, INC."
20011.0,29,2020-02,C00738096,"MATT LAUGHRIDGE FOR CONGRESS, INC."
4165.0,22,2020-02,C00693663,FEENSTRA FOR CONGRESS
226054.23999999184,10715,2020-03,C00547893,ELISE FOR CONGRESS
12399.0,244,2020-01,C00443218,WICKER FOR SENATE
8268.0,24,2020-02,C00458877,KINZINGER FOR CONGRESS
8336.400000000001,28,2020-03,C00459297,HUIZENGA FOR CONGRESS
35924.079999999994,1027,2020-01,C00704981,MICHELLE STEEL FOR CONGRESS
19923.410000000003,146,2020-03,C00706267,ASHLEY HINSON FOR CONGRESS
5163.0,30,2020-02,C00390724,WALBERG FOR CONGRESS
35104.1199999985,2186,2020-02,C00472704,JAIME FOR CONGRESS
4785.0,13,2020-02,C00704064,NEESE FOR CONGRESS
6775.0,9,2020-02,C00734640,FRIENDS OF KERRY W. GIBSON
3600.0,3,2020-01,C00460659,MANN FOR CONGRESS
40765.0,54,2020-02,C00732149,RENEE SWANN FOR CONGRESS
27979.919999999627,2362,2020-02,C00390476,CATHY MCMORRIS RODGERS FOR CONGRESS
67995.95999999999,1536,2020-02,C00721035,CHURCH FOR WISCONSIN
43324.72,374,2020-03,C00712794,JEANNE FOR CONGRESS
34639.549999999996,717,2020-01,C00660795,DAN CRENSHAW FOR CONGRESS
14350.0,61,2020-02,C00713461,KENDALL FOR CONGRESS
75492.54999999999,1936,2020-03,C00730531,TEXANS FOR RONNY JACKSON
48885.71,1657,2020-01,C00620518,MARCO RUBIO FOR SENATE
8666.43,105,2020-03,C00730655,FRIENDS OF EARL GRANVILLE
33235.219999999994,784,2020-01,C00491357,STEVE DAINES FOR MONTANA
14781.0,87,2020-01,C00650697,PETE STAUBER FOR CONGRESS
77999.81,2011,2020-01,C00502039,COLLINS FOR CONGRESS
17398.050000000476,1811,2020-03,C00663914,DEBBIE LESKO FOR CONGRESS
15400.0,44,2020-03,C00639096,BARRY MOORE FOR CONGRESS
8022.5,19,2020-03,C00458877,KINZINGER FOR CONGRESS
23357.97,207,2020-03,C00710103,NANCY MACE FOR CONGRESS
90599.12999999998,3076,2020-03,C00499988,"COTTON FOR SENATE, INC."
5150.0,8,2020-02,C00720607,REEDER FOR CONGRESS
8975.0,10,2020-02,C00460659,MANN FOR CONGRESS
83699.93999999999,2330,2020-03,C00459255,"FRIENDS OF TODD YOUNG, INC."
3378.030000000002,97,2020-03,C00497818,WENSTRUP FOR CONGRESS
4060.0,24,2020-02,C00461806,PAUL GOSAR FOR CONGRESS
8345.0,44,2020-02,C00726141,SHARON BRECKENRIDGE THOMAS FOR CONGRESS
10125.0,27,2020-03,C00722470,RIK FOR NEW JERSEY INC
4010.719999999996,175,2020-01,C00653220,CAROL FOR CONGRESS
2800.0,1,2020-03,C00477323,PALAZZO FOR CONGRESS
105923.93000000001,1733,2020-02,C00736983,"COLLINS FOR SENATE, INC."
8809.33,12,2020-02,C00395467,JEFF FORTENBERRY FOR UNITED STATES CONGRESS
13201.5,275,2020-02,C00409581,FRIENDS OF JOHN THUNE
11800.0,22,2020-03,C00742007,VAN ORDEN FOR CONGRESS
5500.01,82,2020-03,C00670695,ROMNEY FOR UTAH INC
23580.0,834,2020-03,C00608398,JOHN KENNEDY FOR US
76654.91999999987,2167,2020-01,C00499988,"COTTON FOR SENATE, INC."
22141.0,258,2020-03,C00653147,MIKE BRAUN FOR INDIANA
9100.0,7,2020-03,C00458679,BLAINE FOR CONGRESS
53489.729999999974,1683,2020-03,C00703843,BICE FOR CONGRESS
111187.22,5236,2020-03,C00665638,YOUNG KIM FOR CONGRESS
9050.0,11,2020-03,C00726026,FLORIDA CONSERVATIVES PROTECTING AMERICAN VALUES
22087.5,174,2020-01,C00697417,"BYRNE FOR SENATE, INC."
7790.0,14,2020-01,C00717306,CLAIRE CHASE FOR CONGRESS
36925.0,55,2020-01,C00719294,AUGUST PFLUGER FOR CONGRESS
14069.769999999999,118,2020-01,C00554113,RATCLIFFE FOR CONGRESS
3970.0,21,2020-01,C00722389,MARK SHEPHERD FOR CONGRESS
10219.460000000003,55,2020-02,C00657155,TIFFANY SHEDD FOR CONGRESS COMMITTEE
17818.24,420,2020-01,C00470757,VOTETIPTON.COM
12507.0,18,2020-01,C00735688,BOGNET FOR CONGRESS
57684.199999999815,1506,2020-01,C00547570,PERDUE FOR SENATE
31407.47000000006,683,2020-03,C00660795,DAN CRENSHAW FOR CONGRESS
9718.5,295,2020-02,C00502039,COLLINS FOR CONGRESS
103864.39,1579,2020-01,C00734533,DALIA FOR CONGRESS
15330.83,468,2020-01,C00482984,RON JOHNSON FOR SENATE INC
77831.45,1349,2020-03,C00733469,MARK RONCHETTI FOR NEW MEXICO
9417.0,35,2020-01,C00729913,FORD FOR FLORIDA
26385.45,939,2020-02,C00376939,MARSHA FOR SENATE
26542.37,483,2020-01,C00713933,MCLENDON FOR CONGRESS
5000.0,10,2020-01,C00368522,JOE WILSON FOR CONGRESS
26777.559999999998,871,2020-01,C00608398,JOHN KENNEDY FOR US
13628.210000000001,292,2020-01,C00716498,ESTHER FOR CONGRESS
4960.0,12,2020-03,C00721985,KENT ABERNATHY FOR CONGRESS
9575.0,15,2020-03,C00498345,MULLIN FOR CONGRESS
10590.0,22,2020-01,C00393629,MCHENRY FOR CONGRESS
10308.380000000001,43,2020-03,C00559393,DAN NEWHOUSE FOR CONGRESS
4345.0,9,2020-03,C00741561,CONSTITUTIONAL WARRIORS
11380.300000000003,241,2020-01,C00545749,EMMER FOR CONGRESS
12609.789999999994,351,2020-03,C00550707,FRIENDS OF HAGEDORN
10985.530000000012,226,2020-03,C00670737,SINGH FOR SENATE
46955.99999999954,1118,2020-01,C00632257,MAST FOR CONGRESS
14172.720000000003,218,2020-03,C00713230,ROB JONES FOR CONGRESS
9190.0,23,2020-01,C00714907,OLA FOR CONGRESS
28726.7,639,2020-01,C00711689,LACY JOHNSON FOR CONGRESS
28564.140000000003,771,2020-03,C00704981,MICHELLE STEEL FOR CONGRESS
22696.53,501,2020-03,C00499392,VALADAO FOR CONGRESS
20840.00000000001,238,2020-02,C00545616,"YOUNG FOR IOWA, INC."
7581.5,59,2020-02,C00441014,ROB WITTMAN FOR CONGRESS
31142.2,368,2020-02,C00718627,TEAM HAGERTY
4685.0,32,2020-03,C00677286,"STEIL FOR WISCONSIN, INC."
302306.6300000004,12085,2020-01,C00547893,ELISE FOR CONGRESS
10708.0,85,2020-03,C00713412,MESSNER FOR SENATE
9035.0,29,2020-02,C00639096,BARRY MOORE FOR CONGRESS
8545.0,24,2020-01,C00703066,HIGHTOWER FOR ALABAMA
9811.02,23,2020-01,C00693663,FEENSTRA FOR CONGRESS
45632.59999999999,538,2020-03,C00729335,FRIENDS OF NICK FREITAS INC
13200.0,19,2020-03,C00708875,KATHY LANDING FOR CONGRESS
7155.0,41,2020-01,C00724682,FRIENDS OF JOE CAL
4315.0,5,2020-03,C00654723,MEUSER FOR CONGRESS
8500.0,4,2020-01,C00504019,RICK W. ALLEN FOR CONGRESS
3910.0,14,2020-03,C00720011,SCOTT FITZGERALD FOR CONGRESS
7425.0,12,2020-02,C00726109,TERRI FOR CONGRESS
14032.0,88,2020-01,C00718635,"TIFFANY FOR WISCONSIN, INC."
31719.300000000007,458,2020-02,C00734533,DALIA FOR CONGRESS
7120.19,35,2020-01,C00713461,KENDALL FOR CONGRESS
4440.3799999999965,58,2020-01,C00662650,BALDERSON FOR CONGRESS
8407.710000000001,73,2020-02,C00722892,"SCHELLER FOR CONGRESS, INC."
10992.27,90,2020-02,C00730655,FRIENDS OF EARL GRANVILLE
45611.899999999994,819,2020-01,C00570994,ALASKANS FOR DAN SULLIVAN
6908.740000000005,241,2020-02,C00680488,"FRIENDS OF DENVER RIGGLEMAN, INC."
17523.630000000005,256,2020-02,C00660050,COMMITTEE TO RE-ELECT STEVE WATKINS
29029.940000000013,951,2020-02,C00675348,CINDY HYDE-SMITH FOR US SENATE
9360.0,45,2020-01,C00548289,MATT ROSENDALE FOR MONTANA
12316.5,350,2020-01,C00409581,FRIENDS OF JOHN THUNE
11145.0,78,2020-02,C00734731,FRIENDS FOR KATHY BARNETTE
24218.0,144,2020-02,C00703058,KEAN FOR CONGRESS INC
36548.65,731,2020-02,C00539825,CAPITO FOR WEST VIRGINIA
110786.20999999999,1774,2020-01,C00736983,"COLLINS FOR SENATE, INC."
3690.0,12,2020-02,C00725648,BERRYHILL FOR CONGRESS
9425.0,11,2020-03,C00726786,FRIENDS OF JASON ATKINSON
3850.0,3,2020-02,C00721985,KENT ABERNATHY FOR CONGRESS
9295.0,60,2020-02,C00548289,MATT ROSENDALE FOR MONTANA
7600.2,13,2020-01,C00734251,"STREICKER FOR CONGRESS, INC."
4770.0,24,2020-01,C00726596,YUKONG ZHAO FOR CONGRESS
3030.0,5,2020-02,C00654723,MEUSER FOR CONGRESS
2805.0,2,2020-01,C00477323,PALAZZO FOR CONGRESS
17135.0,12,2020-03,C00719294,AUGUST PFLUGER FOR CONGRESS
9700.0,20,2020-02,C00719278,CLIFFORD FOR CONGRESS
18650.0,75,2020-03,C00703066,HIGHTOWER FOR ALABAMA
26566.75,1008,2020-03,C00376939,MARSHA FOR SENATE
10139.0,200,2020-01,C00547976,"BEN SASSE FOR U.S. SENATE, INC."
17800.0,25,2020-03,C00359034,GRAVES FOR CONGRESS
10787.0,123,2020-01,C00726570,OMARI FAULKNER FOR VIRGINIA
5900.0,15,2020-02,C00726950,MCFARLIN FOR CONGRESS
4120.0,8,2020-03,C00732693,SANCHEZ FOR NEW MEXICO
24431.65,614,2020-02,C00459255,"FRIENDS OF TODD YOUNG, INC."
5769.0,24,2020-01,C00716845,KATHALEEN WALL FOR CONGRESS
10505.0,21,2020-01,C00726901,SCOTT BLAND FOR CONGRESS
3040.0,13,2020-03,C00679720,SAMUEL LEE WILLIAMS JR FOR CONGRESS
7380.0,16,2020-03,C00732768,LIPETRI FOR CONGRESS
29229.81,903,2020-03,C00675348,CINDY HYDE-SMITH FOR US SENATE
9183.51,129,2020-02,C00706267,ASHLEY HINSON FOR CONGRESS
5830.0,35,2020-01,C00677286,"STEIL FOR WISCONSIN, INC."
9626.0,69,2020-03,C00713461,KENDALL FOR CONGRESS
22579.55,245,2020-01,C00712794,JEANNE FOR CONGRESS
44740.549999999654,1075,2020-02,C00632257,MAST FOR CONGRESS
12064.400000000001,98,2020-03,C00390724,WALBERG FOR CONGRESS
5745.0,29,2020-02,C00720078,JAY OBERNOLTE FOR CONGRESS 2020
168815.2800000002,5815,2020-03,C00416594,JIM JORDAN FOR CONGRESS
3800.0,4,2020-03,C00498121,ROGER WILLIAMS FOR U S CONGRESS COMMITTEE
35819.31999999999,1134,2020-02,C00661868,VAN DREW FOR CONGRESS
20188.0,427,2020-03,C00711077,LISA SONG SUTTON FOR CONGRESS
7382.0,169,2020-02,C00504704,CRAMER FOR SENATE
16416.0,285,2020-01,C00711077,LISA SONG SUTTON FOR CONGRESS
23634.710000000003,1107,2020-02,C00710814,LYNN AFENDOULIS FOR CONGRESS
16214.0,27,2020-03,C00738096,"MATT LAUGHRIDGE FOR CONGRESS, INC."
44638.359999999964,1261,2020-01,C00416594,JIM JORDAN FOR CONGRESS
4752.27,22,2020-02,C00706614,TONY GONZALES FOR CONGRESS
10341.0,264,2020-03,C00304758,FRIENDS OF ROY BLUNT
38050.44999999996,1086,2020-02,C00540302,TIM SCOTT FOR SENATE
8500.0,21,2020-02,C00726901,SCOTT BLAND FOR CONGRESS
22681.00000000001,466,2020-03,C00143743,REPUBLICAN PARTY OF TEXAS
5480.0,66,2020-02,C00655571,YVETTE4CONGRESS
34326.579999999994,1132,2020-03,C00540302,TIM SCOTT FOR SENATE
8100.45,38,2020-01,C00721126,KNAGGS FOR CONGRESS
9990.42,44,2020-03,C00650697,PETE STAUBER FOR CONGRESS
352932.80000000016,13682,2020-01,C00420935,KEVIN MCCARTHY FOR CONGRESS
4070.0,13,2020-01,C00657833,GUY FOR CONGRESS
7621.0,183,2020-02,C00443218,WICKER FOR SENATE
7455.0,21,2020-03,C00573980,KELLY FOR CONGRESS
7325.0,192,2020-03,C00498907,DEB FISCHER FOR US SENATE
2722.0,13,2020-01,C00541862,JASON SMITH FOR CONGRESS
23117.7,785,2020-01,C00721332,DARRELL ISSA FOR CONGRESS
10767.0,34,2020-02,C00732925,KISTNER FOR CONGRESS
3850.0,25,2020-02,C00697789,JERRY CARL FOR CONGRESS
10189.280000000006,107,2020-02,C00559393,DAN NEWHOUSE FOR CONGRESS
2092.7,9,2020-03,C00554113,RATCLIFFE FOR CONGRESS
16056.0,38,2020-01,C00721092,"DAVID HILL FOR OKLAHOMA, INC."
4025.0,11,2020-01,C00658385,MARK GREEN FOR CONGRESS
6376.119999999998,74,2020-03,C00553859,DR. BRIAN BABIN FOR CONGRESS
4748.39,37,2020-03,C00693663,FEENSTRA FOR CONGRESS
3000.0,7,2020-01,C00725648,BERRYHILL FOR CONGRESS
17496.0,294,2020-01,C00499392,VALADAO FOR CONGRESS
5292.5,21,2020-02,C00726687,PAUL JUNGE FOR CONGRESS
9445.0,17,2020-03,C00395467,JEFF FORTENBERRY FOR UNITED STATES CONGRESS
18811.02000000003,341,2020-03,C00575167,DON BACON FOR CONGRESS
10755.0,87,2020-01,C00732768,LIPETRI FOR CONGRESS
2010.0,2,2020-01,C00468256,BUCSHON FOR CONGRESS
4578.0,12,2020-03,C00720078,JAY OBERNOLTE FOR CONGRESS 2020
4000.0,10,2020-01,C00731539,NATE WILKINS FOR CONGRESS
13060.0,83,2020-03,C00734731,FRIENDS FOR KATHY BARNETTE
15650.0,22,2020-03,C00628917,FRIENDS OF DUSTY JOHNSON
9682.13999999996,368,2020-01,C00467571,"ANDY BARR FOR CONGRESS, INC."
17886.450000000015,474,2020-03,C00371203,JOHN CARTER FOR CONGRESS
30433.62,1021,2020-01,C00540302,TIM SCOTT FOR SENATE
23898.0,861,2020-01,C00676965,RICK SCOTT FOR FLORIDA
33662.859999999004,2206,2020-03,C00472704,JAIME FOR CONGRESS
5110.0,69,2020-03,C00373563,KING FOR CONGRESS
12881.11,285,2020-02,C00304758,FRIENDS OF ROY BLUNT
30149.6099999996,2128,2020-03,C00390476,CATHY MCMORRIS RODGERS FOR CONGRESS
10384.909999999983,443,2020-01,C00200584,UPTON FOR ALL OF US
10192.2,68,2020-03,C00721027,FOSTER FOR KANSAS
14363.010000000004,192,2020-02,C00713230,ROB JONES FOR CONGRESS
5345.0,19,2020-02,C00504019,RICK W. ALLEN FOR CONGRESS
6851.0,55,2020-03,C00548289,MATT ROSENDALE FOR MONTANA
6484.48,78,2020-02,C00553859,DR. BRIAN BABIN FOR CONGRESS
4945.0,17,2020-01,C00720870,JESSE JENSEN FOR CONGRESS
7826.040000000009,275,2020-02,C00575167,DON BACON FOR CONGRESS
6605.0,45,2020-01,C00715698,"JEFF COLEMAN FOR CONGRESS, INC."
10010.00999999996,388,2020-01,C00575167,DON BACON FOR CONGRESS
7695.0,43,2020-02,C00703066,HIGHTOWER FOR ALABAMA
3950.0,18,2020-03,C00694687,TAYLOR FOR CONGRESS
3615.0,32,2020-02,C00677286,"STEIL FOR WISCONSIN, INC."
19976.140000000007,275,2020-02,C00633362,"HANDEL FOR CONGRESS, INC."
3050.0,5,2020-02,C00658385,MARK GREEN FOR CONGRESS
11648.5,282,2020-01,C00436386,FRIENDS OF JOHN BARRASSO
4940.0,35,2020-02,C00734863,REGINA BARR FOR CONGRESS
4628.360000000024,249,2020-01,C00663914,DEBBIE LESKO FOR CONGRESS
5805.0,42,2020-01,C00717876,AMANDA ADKINS FOR CONGRESS
13275.0,22,2020-03,C00738195,VOTEBRIZZI
3145.0,20,2020-03,C00504522,HUDSON FOR CONGRESS
2101.0,15,2020-02,C00721365,DEVOLDER-SANTOS FOR CONGRESS
18657.57000000003,545,2020-02,C00660795,DAN CRENSHAW FOR CONGRESS
17292.480000000032,616,2020-02,C00521948,RODNEY FOR CONGRESS
20129.57,428,2020-01,C00718239,ANNA PAULINA LUNA FOR CONGRESS
1460.0,7,2020-03,C00721365,DEVOLDER-SANTOS FOR CONGRESS
2450.0,8,2020-01,C00726109,TERRI FOR CONGRESS
1500.0,4,2020-03,C00741850,HECKERFORCONGRESS
1700.0,5,2020-02,C00738195,VOTEBRIZZI
1880.0,10,2020-03,C00728170,JARED FOR NEW MEXICO
